-- phpMyAdmin SQL Dump
-- version 5.2.1
-- https://www.phpmyadmin.net/
--
-- Host: localhost:3306
-- Generation Time: May 19, 2023 at 12:14 AM
-- Server version: 5.7.42
-- PHP Version: 8.1.16

SET SQL_MODE = "NO_AUTO_VALUE_ON_ZERO";
START TRANSACTION;
SET time_zone = "+00:00";


/*!40101 SET @OLD_CHARACTER_SET_CLIENT=@@CHARACTER_SET_CLIENT */;
/*!40101 SET @OLD_CHARACTER_SET_RESULTS=@@CHARACTER_SET_RESULTS */;
/*!40101 SET @OLD_COLLATION_CONNECTION=@@COLLATION_CONNECTION */;
/*!40101 SET NAMES utf8mb4 */;

--
-- Database: `retrocub_shotshifter_dev2`
--

-- --------------------------------------------------------

--
-- Table structure for table `application_setting`
--

CREATE TABLE `application_setting` (
  `id` bigint(20) UNSIGNED NOT NULL,
  `identifier` varchar(255) COLLATE utf8mb4_unicode_ci NOT NULL,
  `meta_key` varchar(255) COLLATE utf8mb4_unicode_ci NOT NULL,
  `value` varchar(255) COLLATE utf8mb4_unicode_ci NOT NULL,
  `is_file` tinyint(4) NOT NULL DEFAULT '0',
  `created_at` timestamp NULL DEFAULT NULL,
  `updated_at` timestamp NULL DEFAULT NULL,
  `deleted_at` timestamp NULL DEFAULT NULL
) ENGINE=InnoDB DEFAULT CHARSET=utf8mb4 COLLATE=utf8mb4_unicode_ci;

--
-- Dumping data for table `application_setting`
--

INSERT INTO `application_setting` (`id`, `identifier`, `meta_key`, `value`, `is_file`, `created_at`, `updated_at`, `deleted_at`) VALUES
(1, 'application_setting', 'favicon', 'images/favicon.png', 1, '2021-11-23 12:47:44', NULL, NULL),
(4, 'application_setting', 'application_name', 'Shot Shifter', 0, '2022-01-11 06:02:41', NULL, NULL),
(5, 'application_setting', 'logo', '/storage/application_setting/pCmqd6NhWkhrHkLmVAkQcsWgOT3Jlctl5NGU952g.png', 1, '2022-01-11 06:02:41', NULL, NULL);

-- --------------------------------------------------------

--
-- Table structure for table `breaks`
--

CREATE TABLE `breaks` (
  `id` bigint(20) UNSIGNED NOT NULL,
  `user_id` bigint(20) UNSIGNED NOT NULL,
  `scene_id` bigint(20) UNSIGNED NOT NULL,
  `name` varchar(150) COLLATE utf8mb4_unicode_ci NOT NULL,
  `slug` varchar(150) COLLATE utf8mb4_unicode_ci NOT NULL,
  `status` enum('1','0') COLLATE utf8mb4_unicode_ci NOT NULL DEFAULT '1',
  `date` varchar(100) COLLATE utf8mb4_unicode_ci DEFAULT NULL,
  `time` varchar(100) COLLATE utf8mb4_unicode_ci DEFAULT NULL,
  `created_at` timestamp NULL DEFAULT NULL,
  `updated_at` timestamp NULL DEFAULT NULL,
  `deleted_at` timestamp NULL DEFAULT NULL
) ENGINE=InnoDB DEFAULT CHARSET=utf8mb4 COLLATE=utf8mb4_unicode_ci;

--
-- Dumping data for table `breaks`
--

INSERT INTO `breaks` (`id`, `user_id`, `scene_id`, `name`, `slug`, `status`, `date`, `time`, `created_at`, `updated_at`, `deleted_at`) VALUES
(1, 4, 25, 'B1', '164123413161d33ed36ea3d', '1', NULL, NULL, '2022-01-03 18:22:11', '2022-01-03 18:25:53', '2022-01-03 18:25:53'),
(2, 4, 25, 'B2', '164123413961d33edbb4b03', '1', NULL, NULL, '2022-01-03 18:22:19', '2022-01-03 18:25:24', '2022-01-03 18:25:24'),
(3, 4, 22, 'B3', '164123415061d33ee6b8a77', '1', NULL, NULL, '2022-01-03 18:22:30', '2022-01-03 18:25:34', '2022-01-03 18:25:34'),
(4, 4, 24, 'B4', '164123417061d33efa4c998', '1', NULL, NULL, '2022-01-03 18:22:50', '2022-01-03 18:25:29', '2022-01-03 18:25:29'),
(5, 5, 28, 'Hh', '164123893861d3519abc256', '1', NULL, NULL, '2022-01-03 19:42:18', '2022-01-03 19:42:18', NULL),
(6, 5, 35, 'H', '164126909861d3c76a7db68', '1', NULL, NULL, '2022-01-04 04:04:58', '2022-01-04 04:09:16', '2022-01-04 04:09:16'),
(7, 6, 42, 'Zexe', '164128057361d3f43d7d237', '1', NULL, NULL, '2022-01-04 07:16:13', '2022-01-04 07:16:27', '2022-01-04 07:16:27'),
(8, 6, 40, 'Hhu3txt', '164128076461d3f4fc203e6', '1', NULL, NULL, '2022-01-04 07:19:24', '2022-01-04 09:50:05', '2022-01-04 09:50:05'),
(9, 6, 40, 'Hhu3txt', '164128077261d3f5040fc1f', '1', NULL, NULL, '2022-01-04 07:19:32', '2022-01-04 09:54:52', '2022-01-04 09:54:52'),
(10, 7, 50, 'Ugu', '164128373661d4009839d47', '1', NULL, NULL, '2022-01-04 08:08:56', '2022-01-04 08:10:05', '2022-01-04 08:10:05'),
(11, 4, 71, 'vg', '164136417661d53ad0266ac', '1', NULL, NULL, '2022-01-05 06:29:36', '2022-01-05 06:46:23', '2022-01-05 06:46:23'),
(12, 4, 71, 'vg', '164136417661d53ad06530a', '1', NULL, NULL, '2022-01-05 06:29:36', '2022-01-05 06:46:26', '2022-01-05 06:46:26'),
(13, 4, 71, 'vg', '164136417761d53ad1bc3d2', '1', NULL, NULL, '2022-01-05 06:29:37', '2022-01-05 06:46:28', '2022-01-05 06:46:28'),
(14, 4, 71, 'vg', '164136419061d53adec221d', '1', NULL, NULL, '2022-01-05 06:29:50', '2022-01-05 06:30:12', '2022-01-05 06:30:12'),
(15, 4, 71, 'vg', '164136419061d53adec8ffc', '1', NULL, NULL, '2022-01-05 06:29:50', '2022-01-05 06:30:11', '2022-01-05 06:30:11'),
(16, 4, 71, 'vg', '164136421761d53af92329f', '1', NULL, NULL, '2022-01-05 06:30:17', '2022-01-05 06:50:12', '2022-01-05 06:50:12'),
(17, 4, 71, 'vg', '164136422161d53afd20fa0', '1', NULL, NULL, '2022-01-05 06:30:21', '2022-01-05 06:49:01', '2022-01-05 06:49:01'),
(18, 4, 71, 'vg', '164136422261d53afecf172', '1', NULL, NULL, '2022-01-05 06:30:22', '2022-01-05 06:49:02', '2022-01-05 06:49:02'),
(19, 4, 71, 'vg', '164136422361d53affaa5b5', '1', NULL, NULL, '2022-01-05 06:30:23', '2022-01-05 06:50:17', '2022-01-05 06:50:17'),
(20, 4, 71, 'vg', '164136422461d53b0032bfb', '1', NULL, NULL, '2022-01-05 06:30:24', '2022-01-05 06:50:18', '2022-01-05 06:50:18'),
(21, 5, 36, 'Chch', '164136475461d53d1237ce9', '1', NULL, NULL, '2022-01-05 06:39:14', '2022-01-05 06:43:10', '2022-01-05 06:43:10'),
(22, 5, 36, 'Chch', '164136499861d53e0671f17', '1', NULL, NULL, '2022-01-05 06:43:18', '2022-01-05 06:43:24', '2022-01-05 06:43:24'),
(23, 5, 36, 'Chch', '164136500261d53e0a1ae10', '1', NULL, NULL, '2022-01-05 06:43:22', '2022-01-05 06:43:30', '2022-01-05 06:43:30'),
(24, 5, 36, 'Chch', '164136501561d53e17124bb', '1', NULL, NULL, '2022-01-05 06:43:35', '2022-01-05 06:46:50', '2022-01-05 06:46:50'),
(25, 4, 71, 'ggcgc', '164136517961d53ebb02d57', '1', NULL, NULL, '2022-01-05 06:46:19', '2022-01-05 06:54:49', '2022-01-05 06:54:49'),
(26, 4, 71, 'ggcgc', '164136517961d53ebb37b14', '1', NULL, NULL, '2022-01-05 06:46:19', '2022-01-05 07:01:43', '2022-01-05 07:01:43'),
(27, 4, 71, 'ggcgc', '164136517961d53ebb4fd1e', '1', NULL, NULL, '2022-01-05 06:46:19', '2022-01-05 07:04:06', '2022-01-05 07:04:06'),
(28, 4, 71, 'ggcgc', '164136517961d53ebb9592b', '1', NULL, NULL, '2022-01-05 06:46:19', '2022-01-05 07:04:08', '2022-01-05 07:04:08'),
(29, 5, 36, 'Cvv', '164136522361d53ee790c3b', '1', NULL, NULL, '2022-01-05 06:47:03', '2022-01-05 06:47:16', '2022-01-05 06:47:16'),
(30, 5, 36, 'Cvv', '164136522861d53eec3ec0e', '1', NULL, NULL, '2022-01-05 06:47:08', '2022-01-05 06:47:19', '2022-01-05 06:47:19'),
(31, 5, 36, 'Cvv', '164136523361d53ef1a7a3d', '1', NULL, NULL, '2022-01-05 06:47:13', '2022-01-05 06:47:20', '2022-01-05 06:47:20'),
(32, 5, 29, 'Fg', '164136548961d53ff19567f', '1', NULL, NULL, '2022-01-05 06:51:29', '2022-01-05 06:51:29', NULL),
(33, 6, 66, 'Ft', '164136551461d5400a09b43', '1', NULL, NULL, '2022-01-05 06:51:54', '2022-01-05 06:52:23', '2022-01-05 06:52:23'),
(34, 6, 66, 'Ft', '164136551961d5400f7ef4b', '1', NULL, NULL, '2022-01-05 06:51:59', '2022-01-05 06:52:18', '2022-01-05 06:52:18'),
(35, 6, 66, 'Ft', '164136552461d54014582ce', '1', NULL, NULL, '2022-01-05 06:52:04', '2022-01-05 06:52:18', '2022-01-05 06:52:18'),
(36, 6, 66, 'Ft', '164136552561d540150245d', '1', NULL, NULL, '2022-01-05 06:52:05', '2022-01-05 06:52:21', '2022-01-05 06:52:21'),
(37, 6, 66, 'Ft', '164136552861d540181df06', '1', NULL, NULL, '2022-01-05 06:52:08', '2022-01-05 06:52:20', '2022-01-05 06:52:20'),
(38, 6, 66, 'Ft', '164136552861d5401833f14', '1', NULL, NULL, '2022-01-05 06:52:08', '2022-01-05 06:52:20', '2022-01-05 06:52:20'),
(39, 6, 66, 'Ft', '164136555561d540336557a', '1', NULL, NULL, '2022-01-05 06:52:35', '2022-01-05 06:53:10', '2022-01-05 06:53:10'),
(40, 6, 66, 'Ft', '164136555861d54036d8c6a', '1', NULL, NULL, '2022-01-05 06:52:38', '2022-01-05 06:53:11', '2022-01-05 06:53:11'),
(41, 6, 66, 'Ft', '164136555961d54037b90cb', '1', NULL, NULL, '2022-01-05 06:52:39', '2022-01-05 06:53:21', '2022-01-05 06:53:21'),
(42, 6, 66, 'Ft', '164136556161d540399fdfc', '1', NULL, NULL, '2022-01-05 06:52:41', '2022-01-05 06:53:11', '2022-01-05 06:53:11'),
(43, 6, 66, 'Ft', '164136556161d54039ccc94', '1', NULL, NULL, '2022-01-05 06:52:41', '2022-01-05 06:53:16', '2022-01-05 06:53:16'),
(44, 6, 66, 'Ft', '164136563261d540809285c', '1', NULL, NULL, '2022-01-05 06:53:52', '2022-01-05 06:54:08', '2022-01-05 06:54:08'),
(45, 6, 66, 'Ft', '164136563661d54084b45e6', '1', NULL, NULL, '2022-01-05 06:53:56', '2022-01-05 06:54:10', '2022-01-05 06:54:10'),
(46, 6, 66, 'Ft', '164136563761d5408578c76', '1', NULL, NULL, '2022-01-05 06:53:57', '2022-01-05 08:17:29', '2022-01-05 08:17:29'),
(47, 6, 66, 'Ft', '164136564061d540884f60c', '1', NULL, NULL, '2022-01-05 06:54:00', '2022-01-05 06:54:13', '2022-01-05 06:54:13'),
(48, 6, 66, 'Ft', '164136564061d5408875ac9', '1', NULL, NULL, '2022-01-05 06:54:00', '2022-01-05 06:54:12', '2022-01-05 06:54:12'),
(49, 6, 66, 'Ft', '164136564461d5408c18e5c', '1', NULL, NULL, '2022-01-05 06:54:04', '2022-01-05 08:17:34', '2022-01-05 08:17:34'),
(50, 6, 66, 'Ft', '164136564461d5408c2f979', '1', NULL, NULL, '2022-01-05 06:54:04', '2022-01-05 08:17:37', '2022-01-05 08:17:37'),
(51, 2, 15, 'Sadas', '164136586161d54165eac07', '1', NULL, NULL, '2022-01-05 06:57:41', '2022-01-05 07:39:57', '2022-01-05 07:39:57'),
(52, 2, 15, 'Sadas', '164136586261d54166824c3', '1', NULL, NULL, '2022-01-05 06:57:42', '2022-01-05 07:39:57', '2022-01-05 07:39:57'),
(53, 2, 15, 'Sadas', '164136586261d54166d00ad', '1', NULL, NULL, '2022-01-05 06:57:42', '2022-01-05 06:58:01', '2022-01-05 06:58:01'),
(54, 2, 15, 'Sadas', '164136586761d5416b56d3b', '1', NULL, NULL, '2022-01-05 06:57:47', '2022-01-05 06:58:01', '2022-01-05 06:58:01'),
(55, 2, 15, 'Sadas', '164136586761d5416bd13f5', '1', NULL, NULL, '2022-01-05 06:57:47', '2022-01-05 07:40:05', '2022-01-05 07:40:05'),
(56, 2, 15, 'Sadas', '164136586861d5416cb25dd', '1', NULL, NULL, '2022-01-05 06:57:48', '2022-01-05 07:40:01', '2022-01-05 07:40:01'),
(57, 2, 15, 'Sadas', '164136587361d54171951c1', '1', NULL, NULL, '2022-01-05 06:57:53', '2022-01-05 07:39:59', '2022-01-05 07:39:59'),
(58, 2, 15, 'Sadas', '164136587461d541725f6eb', '1', NULL, NULL, '2022-01-05 06:57:54', '2022-01-05 07:39:59', '2022-01-05 07:39:59'),
(59, 4, 23, 'xhhx', '164136592561d541a5406de', '1', NULL, NULL, '2022-01-05 06:58:45', '2022-01-05 06:58:48', '2022-01-05 06:58:48'),
(60, 4, 23, 'xhhx', '164136592561d541a552d99', '1', NULL, NULL, '2022-01-05 06:58:45', '2022-01-05 06:59:04', '2022-01-05 06:59:04'),
(61, 4, 23, 'xhhx', '164136592561d541a586df4', '1', NULL, NULL, '2022-01-05 06:58:45', '2022-01-05 06:59:06', '2022-01-05 06:59:06'),
(62, 4, 23, 'xhhx', '164136592561d541a5d2f16', '1', NULL, NULL, '2022-01-05 06:58:45', '2022-01-05 06:59:10', '2022-01-05 06:59:10'),
(63, 5, 29, 'Fg', '164136648961d543d954faa', '1', NULL, NULL, '2022-01-05 07:08:09', '2022-01-05 07:08:09', NULL),
(64, 5, 29, 'Fg', '164136649761d543e1e7024', '1', NULL, NULL, '2022-01-05 07:08:17', '2022-01-05 07:08:17', NULL),
(65, 5, 29, 'Fg', '164136650461d543e84d1b6', '1', NULL, NULL, '2022-01-05 07:08:24', '2022-01-05 07:08:24', NULL),
(66, 5, 76, 'G', '164136652161d543f99f62b', '1', NULL, NULL, '2022-01-05 07:08:41', '2022-01-05 07:08:57', '2022-01-05 07:08:57'),
(67, 5, 76, 'G', '164136653061d54402c5e90', '1', NULL, NULL, '2022-01-05 07:08:50', '2022-01-05 07:08:59', '2022-01-05 07:08:59'),
(68, 5, 76, 'G', '164136653461d54406c0e2e', '1', NULL, NULL, '2022-01-05 07:08:54', '2022-01-05 07:08:59', '2022-01-05 07:08:59'),
(69, 5, 76, 'G', '164136654461d5441015b1d', '1', NULL, NULL, '2022-01-05 07:09:04', '2022-01-05 07:09:19', '2022-01-05 07:09:19'),
(70, 5, 76, 'G', '164136654761d5441381647', '1', NULL, NULL, '2022-01-05 07:09:07', '2022-01-05 07:09:27', '2022-01-05 07:09:27'),
(71, 5, 76, 'G', '164136655161d54417a4f5a', '1', NULL, NULL, '2022-01-05 07:09:11', '2022-01-05 07:09:22', '2022-01-05 07:09:22'),
(72, 5, 76, 'G', '164136655661d5441c6b420', '1', NULL, NULL, '2022-01-05 07:09:16', '2022-01-05 07:09:20', '2022-01-05 07:09:20'),
(73, 2, 15, 'Rewrew', '164136876261d54cbacee44', '1', NULL, NULL, '2022-01-05 07:46:02', '2022-01-05 07:48:24', '2022-01-05 07:48:24'),
(74, 2, 15, 'Rewrew', '164136876361d54cbb22060', '1', NULL, NULL, '2022-01-05 07:46:03', '2022-01-05 07:49:20', '2022-01-05 07:49:20'),
(75, 2, 15, 'Rewrew', '164136876361d54cbb79c74', '1', NULL, NULL, '2022-01-05 07:46:03', '2022-01-05 07:53:38', '2022-01-05 07:53:38'),
(76, 2, 15, 'Rewrew', '164136876361d54cbbc6869', '1', NULL, NULL, '2022-01-05 07:46:03', '2022-01-05 07:54:04', '2022-01-05 07:54:04'),
(77, 2, 15, 'Rewrew', '164136876961d54cc140088', '1', NULL, NULL, '2022-01-05 07:46:09', '2022-01-05 07:54:05', '2022-01-05 07:54:05'),
(78, 2, 15, 'Rewrew', '164136876961d54cc1e1b33', '1', NULL, NULL, '2022-01-05 07:46:09', '2022-01-05 07:54:06', '2022-01-05 07:54:06'),
(79, 2, 15, 'Sdasd', '164136927261d54eb89773f', '1', NULL, NULL, '2022-01-05 07:54:32', '2022-01-05 07:54:55', '2022-01-05 07:54:55'),
(80, 2, 15, 'Sdasd', '164136927261d54eb8cb697', '1', NULL, NULL, '2022-01-05 07:54:32', '2022-01-05 07:55:04', '2022-01-05 07:55:04'),
(81, 2, 15, 'Sdasd', '164136927361d54eb922233', '1', NULL, NULL, '2022-01-05 07:54:33', '2022-01-05 08:01:22', '2022-01-05 08:01:22'),
(82, 2, 15, 'Sdasd', '164136927361d54eb97bf38', '1', NULL, NULL, '2022-01-05 07:54:33', '2022-01-05 08:03:53', '2022-01-05 08:03:53'),
(83, 2, 15, 'Sdasd', '164136928061d54ec0c65db', '1', NULL, NULL, '2022-01-05 07:54:40', '2022-01-05 08:02:49', '2022-01-05 08:02:49'),
(84, 2, 15, 'Sdasd', '164136928061d54ec0c669b', '1', NULL, NULL, '2022-01-05 07:54:40', '2022-01-05 08:03:58', '2022-01-05 08:03:58'),
(85, 2, 15, 'Sdasd', '164136928561d54ec53d2ac', '1', NULL, NULL, '2022-01-05 07:54:45', '2022-01-05 08:02:52', '2022-01-05 08:02:52'),
(86, 2, 15, 'Sdasd', '164136928561d54ec55a854', '1', NULL, NULL, '2022-01-05 07:54:45', '2022-01-05 08:09:19', '2022-01-05 08:09:19'),
(87, 2, 15, 'Fffff', '164136974661d550920320c', '1', NULL, NULL, '2022-01-05 08:02:26', '2022-01-05 08:04:02', '2022-01-05 08:04:02'),
(88, 2, 15, 'Fffff', '164136974661d5509231cc6', '1', NULL, NULL, '2022-01-05 08:02:26', '2022-01-05 08:02:42', '2022-01-05 08:02:42'),
(89, 2, 15, 'Fffff', '164136974661d5509275cfe', '1', NULL, NULL, '2022-01-05 08:02:26', '2022-01-05 08:02:38', '2022-01-05 08:02:38'),
(90, 2, 14, 'Lop', '164136979061d550beed57d', '1', NULL, NULL, '2022-01-05 08:03:10', '2022-01-05 08:03:30', '2022-01-05 08:03:30'),
(91, 2, 57, 'Lop', '164136979961d550c70e934', '1', NULL, NULL, '2022-01-05 08:03:19', '2022-01-05 08:03:34', '2022-01-05 08:03:34'),
(92, 2, 57, 'Lop', '164136980061d550c88ff18', '1', NULL, NULL, '2022-01-05 08:03:20', '2022-01-05 08:03:40', '2022-01-05 08:03:40'),
(93, 2, 57, 'Lop', '164136980161d550c92d4e5', '1', NULL, NULL, '2022-01-05 08:03:21', '2022-01-05 08:12:35', '2022-01-05 08:12:35'),
(94, 2, 57, 'Lop', '164137016661d5523664b36', '1', NULL, NULL, '2022-01-05 08:09:26', '2022-01-05 08:09:26', NULL),
(95, 2, 57, 'Lop', '164137016661d5523688c98', '1', NULL, NULL, '2022-01-05 08:09:26', '2022-01-05 08:09:26', NULL),
(96, 2, 57, 'Lop', '164137016661d55236ea48b', '1', NULL, NULL, '2022-01-05 08:09:26', '2022-01-05 08:09:26', NULL),
(97, 2, 14, 'Ssdas', '164137020461d5525cba110', '1', NULL, NULL, '2022-01-05 08:10:04', '2022-01-05 08:11:53', '2022-01-05 08:11:53'),
(98, 2, 14, 'Ssdas', '164137020561d5525d07aef', '1', NULL, NULL, '2022-01-05 08:10:05', '2022-01-05 08:10:21', '2022-01-05 08:10:21'),
(99, 2, 14, 'Ssdas', '164137020561d5525d8184a', '1', NULL, NULL, '2022-01-05 08:10:05', '2022-01-05 08:11:10', '2022-01-05 08:11:10'),
(100, 2, 14, 'Ssdas', '164137021361d55265c0e94', '1', NULL, NULL, '2022-01-05 08:10:13', '2022-01-05 08:10:29', '2022-01-05 08:10:29'),
(101, 2, 14, 'Ssdas', '164137021361d55265e27de', '1', NULL, NULL, '2022-01-05 08:10:13', '2022-01-05 08:11:19', '2022-01-05 08:11:19'),
(102, 2, 14, 'Ssdas', '164137021461d552662057b', '1', NULL, NULL, '2022-01-05 08:10:14', '2022-01-05 08:11:58', '2022-01-05 08:11:58'),
(103, 6, 68, 'Cggg', '164137070661d55452ebede', '1', NULL, NULL, '2022-01-05 08:18:26', '2022-01-05 08:22:46', '2022-01-05 08:22:46'),
(104, 6, 68, 'Cggg', '164137070761d554532611d', '1', NULL, NULL, '2022-01-05 08:18:27', '2022-01-05 08:22:51', '2022-01-05 08:22:51'),
(105, 6, 68, 'Cggg', '164137070761d55453396be', '1', NULL, NULL, '2022-01-05 08:18:27', '2022-01-05 08:36:33', '2022-01-05 08:36:33'),
(106, 6, 66, 'Xdt', '164137098461d555687688c', '1', NULL, NULL, '2022-01-05 08:23:04', '2022-01-05 08:24:48', '2022-01-05 08:24:48'),
(107, 6, 66, 'Zded', '164137104861d555a8b2c38', '1', NULL, NULL, '2022-01-05 08:24:08', '2022-01-05 08:24:08', NULL),
(108, 6, 66, 'Zded', '164137105261d555accdcfd', '1', NULL, NULL, '2022-01-05 08:24:12', '2022-01-05 08:24:41', '2022-01-05 08:24:41'),
(109, 6, 66, 'Zded,d28hx1e8hxe1d7de', '164137105961d555b38fbdc', '1', NULL, NULL, '2022-01-05 08:24:19', '2022-01-05 08:24:25', '2022-01-05 08:24:25'),
(110, 6, 67, 'Oooo', '164137111261d555e86f83b', '1', NULL, NULL, '2022-01-05 08:25:12', '2022-01-05 08:25:12', NULL),
(111, 6, 67, 'Oooo', '164137111761d555ed1a167', '1', NULL, NULL, '2022-01-05 08:25:17', '2022-01-05 08:25:37', '2022-01-05 08:25:37'),
(112, 6, 67, 'Oooo1d9ge97d9du', '164137112461d555f4b31d5', '1', NULL, NULL, '2022-01-05 08:25:24', '2022-01-05 08:25:24', NULL),
(113, 6, 67, 'Oooo1d9ge97d927ge27gd2ugd238du', '164137112961d555f9d0008', '1', NULL, NULL, '2022-01-05 08:25:29', '2022-01-05 08:25:41', '2022-01-05 08:25:41'),
(114, 2, 83, 'Dsfds', '164137137861d556f2d2eb5', '1', NULL, NULL, '2022-01-05 08:29:38', '2022-01-05 08:32:00', '2022-01-05 08:32:00'),
(115, 2, 83, 'Dsfds', '164137137961d556f3bc914', '1', NULL, NULL, '2022-01-05 08:29:39', '2022-01-05 08:31:39', '2022-01-05 08:31:39'),
(116, 2, 84, 'Dsfds', '164137138861d556fcdca7a', '1', NULL, NULL, '2022-01-05 08:29:48', '2022-01-05 08:30:27', '2022-01-05 08:30:27'),
(117, 2, 84, 'Dsfds', '164137140061d557084d55e', '1', NULL, NULL, '2022-01-05 08:30:00', '2022-01-05 08:30:31', '2022-01-05 08:30:31'),
(118, 2, 84, 'Dsfds', '164137140161d5570927ab6', '1', NULL, NULL, '2022-01-05 08:30:01', '2022-01-05 08:30:37', '2022-01-05 08:30:37'),
(119, 2, 85, 'Ffffff', '164137145261d5573c224e4', '1', NULL, NULL, '2022-01-05 08:30:52', '2022-01-05 08:30:52', NULL),
(120, 2, 83, 'Ccccc', '164137146961d5574dc8849', '1', NULL, NULL, '2022-01-05 08:31:09', '2022-01-05 08:32:22', '2022-01-05 08:32:22'),
(121, 2, 83, 'Ccccc', '164137155961d557a718ce6', '1', NULL, NULL, '2022-01-05 08:32:39', '2022-01-05 08:34:03', '2022-01-05 08:34:03'),
(122, 2, 83, 'Ccccc', '164137156061d557a806de2', '1', NULL, NULL, '2022-01-05 08:32:40', '2022-01-05 08:32:40', NULL),
(123, 2, 83, 'Hhhh', '164137156761d557af3482b', '1', NULL, NULL, '2022-01-05 08:32:47', '2022-01-05 08:32:47', NULL),
(124, 2, 83, 'Hhhh', '164137156861d557b01316f', '1', NULL, NULL, '2022-01-05 08:32:48', '2022-01-05 08:32:48', NULL),
(125, 2, 83, 'Gggggg', '164137157761d557b94258b', '1', NULL, NULL, '2022-01-05 08:32:57', '2022-01-05 08:32:57', NULL),
(126, 2, 83, 'Qwerrr', '164137161061d557daec8dc', '1', NULL, NULL, '2022-01-05 08:33:30', '2022-01-05 08:33:39', '2022-01-05 08:33:39'),
(127, 2, 86, 'Qwerrr', '164137162861d557ec0018c', '1', NULL, NULL, '2022-01-05 08:33:48', '2022-01-05 08:33:56', '2022-01-05 08:33:56'),
(128, 6, 69, 'F32tb3t', '164137181161d558a30ae54', '1', NULL, NULL, '2022-01-05 08:36:51', '2022-01-05 08:37:50', '2022-01-05 08:37:50'),
(129, 6, 68, 'F32tb3t', '164137181961d558ab95b7a', '1', NULL, NULL, '2022-01-05 08:36:59', '2022-01-05 08:37:12', '2022-01-05 08:37:12'),
(130, 6, 68, 'F32tb3t', '164137182461d558b0f2766', '1', NULL, NULL, '2022-01-05 08:37:04', '2022-01-05 08:37:47', '2022-01-05 08:37:47'),
(131, 6, 68, 'F32tb3t', '164137187761d558e5e768e', '1', NULL, NULL, '2022-01-05 08:37:57', '2022-01-05 08:50:38', '2022-01-05 08:50:38'),
(132, 6, 68, 'F32tb3t', '164137188161d558e96f6a7', '1', NULL, NULL, '2022-01-05 08:38:01', '2022-01-05 09:55:16', '2022-01-05 09:55:16'),
(133, 6, 68, 'F32tb3t', '164137188461d558ec2095f', '1', NULL, NULL, '2022-01-05 08:38:04', '2022-01-05 08:38:12', '2022-01-05 08:38:12'),
(134, 6, 68, 'F32tb3t', '164137188761d558ef6804c', '1', NULL, NULL, '2022-01-05 08:38:07', '2022-01-05 09:55:24', '2022-01-05 09:55:24'),
(135, 4, 24, 'hdhd', '164137241161d55afba046c', '1', NULL, NULL, '2022-01-05 08:46:51', '2022-01-05 08:46:57', '2022-01-05 08:46:57'),
(136, 4, 24, 'hdhd', '164137241161d55afbb643e', '1', NULL, NULL, '2022-01-05 08:46:51', '2022-01-05 08:46:57', '2022-01-05 08:46:57'),
(137, 4, 24, 'hdhd', '164137241161d55afbed01d', '1', NULL, NULL, '2022-01-05 08:46:51', '2022-01-05 08:46:59', '2022-01-05 08:46:59'),
(138, 4, 24, 'hdhd', '164137241261d55afc35170', '1', NULL, NULL, '2022-01-05 08:46:52', '2022-01-05 08:47:00', '2022-01-05 08:47:00'),
(139, 4, 24, 'hdhd', '164137242961d55b0d99423', '1', NULL, NULL, '2022-01-05 08:47:09', '2022-01-05 08:47:30', '2022-01-05 08:47:30'),
(140, 4, 24, 'hdhd', '164137242961d55b0ddf3e8', '1', NULL, NULL, '2022-01-05 08:47:09', '2022-01-05 08:47:30', '2022-01-05 08:47:30'),
(141, 4, 24, 'hdhd', '164137243061d55b0e1c000', '1', NULL, NULL, '2022-01-05 08:47:10', '2022-01-05 08:47:30', '2022-01-05 08:47:30'),
(142, 4, 24, 'hdhd', '164137243061d55b0e7c162', '1', NULL, NULL, '2022-01-05 08:47:10', '2022-01-05 08:47:35', '2022-01-05 08:47:35'),
(143, 4, 24, 'hdhd', '164137243361d55b11e46d5', '1', NULL, NULL, '2022-01-05 08:47:13', '2022-01-05 08:47:32', '2022-01-05 08:47:32'),
(144, 4, 24, 'hdhd', '164137243461d55b1236127', '1', NULL, NULL, '2022-01-05 08:47:14', '2022-01-05 08:47:33', '2022-01-05 08:47:33'),
(145, 4, 24, 'hdhd', '164137243461d55b127c416', '1', NULL, NULL, '2022-01-05 08:47:14', '2022-01-05 08:47:38', '2022-01-05 08:47:38'),
(146, 4, 24, 'hdhd', '164137250061d55b5401cc1', '1', NULL, NULL, '2022-01-05 08:48:20', '2022-01-05 09:03:58', '2022-01-05 09:03:58'),
(147, 4, 24, 'hdhd', '164137250061d55b542e1e5', '1', NULL, NULL, '2022-01-05 08:48:20', '2022-01-05 09:19:10', '2022-01-05 09:19:10'),
(148, 4, 24, 'hdhd', '164137250061d55b547763c', '1', NULL, NULL, '2022-01-05 08:48:20', '2022-01-05 11:12:04', '2022-01-05 11:12:04'),
(149, 4, 24, 'hdhd', '164137250061d55b54c9df7', '1', NULL, NULL, '2022-01-05 08:48:20', '2022-01-05 08:48:20', NULL),
(150, 6, 68, 'Qqq', '164137265361d55bed04906', '1', NULL, NULL, '2022-01-05 08:50:53', '2022-01-05 08:50:53', NULL),
(151, 6, 69, 'Tdtd', '164137656961d56b3999f6a', '1', NULL, NULL, '2022-01-05 09:56:09', '2022-01-05 09:56:09', NULL),
(152, 6, 69, 'Tdtd', '164137657661d56b40bc1a0', '1', NULL, NULL, '2022-01-05 09:56:16', '2022-01-05 09:56:23', '2022-01-05 09:56:23'),
(153, 6, 68, 'Tdtdxtuxur', '164137659561d56b53dc9ca', '1', NULL, NULL, '2022-01-05 09:56:35', '2022-01-05 09:56:35', NULL),
(154, 6, 89, 'Sjsj', '164137672461d56bd491d3f', '1', NULL, NULL, '2022-01-05 09:58:44', '2022-01-05 09:59:05', '2022-01-05 09:59:05'),
(155, 6, 89, 'Sjsj', '164137673561d56bdfa7a90', '1', NULL, NULL, '2022-01-05 09:58:55', '2022-01-05 10:00:03', '2022-01-05 10:00:03'),
(156, 6, 89, 'Sjsj', '164137681761d56c31603c0', '1', NULL, NULL, '2022-01-05 10:00:17', '2022-01-05 10:03:01', '2022-01-05 10:03:01'),
(157, 6, 88, 'Sjsj', '164137682661d56c3a4023a', '1', NULL, NULL, '2022-01-05 10:00:26', '2022-01-05 10:00:45', '2022-01-05 10:00:45'),
(158, 6, 88, 'Sjsj', '164137683161d56c3f5db86', '1', NULL, NULL, '2022-01-05 10:00:31', '2022-01-05 10:16:29', '2022-01-05 10:16:29'),
(159, 6, 90, 'Sjsj', '164137683961d56c479337c', '1', NULL, NULL, '2022-01-05 10:00:39', '2022-01-05 10:00:52', '2022-01-05 10:00:52'),
(160, 6, 89, 'Sdas', '164137709761d56d491cf47', '1', NULL, NULL, '2022-01-05 10:04:57', '2022-01-05 10:16:34', '2022-01-05 10:16:34'),
(161, 6, 89, 'Sdas', '164137709861d56d4a2d58a', '1', NULL, NULL, '2022-01-05 10:04:58', '2022-01-05 10:16:39', '2022-01-05 10:16:39'),
(162, 6, 89, 'Sdas', '164137710361d56d4fc8026', '1', NULL, NULL, '2022-01-05 10:05:03', '2022-01-05 10:16:01', '2022-01-05 10:16:01'),
(163, 6, 89, 'Sdasdddddddd', '164137710961d56d5577e62', '1', NULL, NULL, '2022-01-05 10:05:09', '2022-01-05 10:23:18', '2022-01-05 10:23:18'),
(164, 9, 92, 'Dhdh', '164137731661d56e2455af1', '1', NULL, NULL, '2022-01-05 10:08:36', '2022-01-05 10:08:36', NULL),
(165, 9, 92, 'Dhdh', '164137732261d56e2a5a135', '1', NULL, NULL, '2022-01-05 10:08:42', '2022-01-05 10:08:48', '2022-01-05 10:08:48'),
(166, 6, 89, 'Sdasdddddddd', '164137798161d570bd96a12', '1', NULL, NULL, '2022-01-05 10:19:41', '2022-01-05 10:29:56', '2022-01-05 10:29:56'),
(167, 6, 88, 'Xrzr', '164137821061d571a2abd8c', '1', NULL, NULL, '2022-01-05 10:23:30', '2022-01-05 10:33:21', '2022-01-05 10:33:21'),
(168, 6, 98, 'Ssysyzzz', '164137836461d5723c71e10', '1', NULL, NULL, '2022-01-05 10:26:04', '2022-01-05 10:27:15', '2022-01-05 10:27:15'),
(169, 6, 98, 'Ssysyzzz', '164137836861d5724064c9a', '1', NULL, NULL, '2022-01-05 10:26:08', '2022-01-05 10:46:33', '2022-01-05 10:46:33'),
(170, 6, 98, 'Ssysyzzz', '164137836961d57241d3482', '1', NULL, NULL, '2022-01-05 10:26:09', '2022-01-05 10:27:19', '2022-01-05 10:27:19'),
(171, 6, 98, 'Xxx', '164137837961d5724b64929', '1', NULL, NULL, '2022-01-05 10:26:19', '2022-01-05 11:18:57', '2022-01-05 11:18:57'),
(172, 6, 98, 'Xxx', '164137838061d5724cc56db', '1', NULL, NULL, '2022-01-05 10:26:20', '2022-01-05 10:26:20', NULL),
(173, 6, 98, 'Xxx', '164137838561d572513b81f', '1', NULL, NULL, '2022-01-05 10:26:25', '2022-01-05 10:26:25', NULL),
(174, 6, 98, 'Xxx', '164137838861d57254d0f1d', '1', NULL, NULL, '2022-01-05 10:26:28', '2022-01-05 10:26:28', NULL),
(175, 6, 98, 'Xxx', '164137839261d57258765ed', '1', NULL, NULL, '2022-01-05 10:26:32', '2022-01-05 11:19:04', '2022-01-05 11:19:04'),
(176, 6, 98, 'Xxx', '164137839661d5725c6ad31', '1', NULL, NULL, '2022-01-05 10:26:36', '2022-01-05 10:26:36', NULL),
(177, 6, 98, 'Xxx', '164137839761d5725dd16dc', '1', NULL, NULL, '2022-01-05 10:26:37', '2022-01-05 10:26:37', NULL),
(178, 6, 98, 'Kkk', '164137840561d57265241e0', '1', NULL, NULL, '2022-01-05 10:26:45', '2022-01-05 10:26:45', NULL),
(179, 6, 98, 'Kkkdd', '164137840961d5726941c55', '1', NULL, NULL, '2022-01-05 10:26:49', '2022-01-05 10:46:41', '2022-01-05 10:46:41'),
(180, 6, 98, 'Kkkdd', '164137841061d5726a9d495', '1', NULL, NULL, '2022-01-05 10:26:50', '2022-01-05 10:26:50', NULL),
(181, 6, 88, 'Govi', '164137852261d572dabdb14', '1', NULL, NULL, '2022-01-05 10:28:42', '2022-01-05 10:33:24', '2022-01-05 10:33:24'),
(182, 6, 88, 'Goviffd', '164137853361d572e5acbed', '1', NULL, NULL, '2022-01-05 10:28:53', '2022-01-05 10:28:53', NULL),
(183, 6, 90, 'Fyf6', '164137876461d573cc51941', '1', NULL, NULL, '2022-01-05 10:32:44', '2022-01-05 10:32:44', NULL),
(184, 6, 88, 'Eusi', '164137902361d574cf888ea', '1', NULL, NULL, '2022-01-05 10:37:03', '2022-01-05 10:37:03', NULL),
(185, 6, 88, 'Eusi', '164137902761d574d3d3362', '1', NULL, NULL, '2022-01-05 10:37:07', '2022-01-05 10:52:04', '2022-01-05 10:52:04'),
(186, 6, 88, 'Eusigg', '164137933561d576073a5ef', '1', NULL, NULL, '2022-01-05 10:42:15', '2022-01-05 10:42:15', NULL),
(187, 4, 23, 'Bdhdh', '164138161761d57ef11a083', '1', NULL, NULL, '2022-01-05 11:20:17', '2022-01-05 11:23:32', '2022-01-05 11:23:32'),
(188, 4, 23, 'Bdhdh', '164138162461d57ef86da22', '1', NULL, NULL, '2022-01-05 11:20:24', '2022-01-05 11:20:24', NULL),
(189, 4, 71, 'Chvu', '164138193061d5802abcd1c', '1', NULL, NULL, '2022-01-05 11:25:30', '2022-01-06 14:18:00', '2022-01-06 14:18:00'),
(190, 4, 107, 'Bzbz', '164147832561d6f8b5689b9', '1', NULL, NULL, '2022-01-06 14:12:05', '2022-01-06 14:12:05', NULL),
(191, 4, 81, 'Hh', '164147865561d6f9ff270fd', '1', NULL, NULL, '2022-01-06 14:17:35', '2022-01-06 14:17:35', NULL),
(192, 4, 81, 'Hh', '164147899361d6fb5127da7', '1', NULL, NULL, '2022-01-06 14:23:13', '2022-01-06 14:23:13', NULL),
(193, 4, 71, 'Hh', '164147900661d6fb5e88ac4', '1', NULL, NULL, '2022-01-06 14:23:26', '2022-01-06 14:23:26', NULL),
(194, 6, 146, 'Gggg', '164155239761d81a0dedca9', '1', NULL, NULL, '2022-01-07 10:46:37', '2022-01-07 11:04:16', '2022-01-07 11:04:16'),
(195, 6, 146, 'Gggg', '164155239861d81a0ed9090', '1', NULL, NULL, '2022-01-07 10:46:38', '2022-01-07 10:46:43', '2022-01-07 10:46:43'),
(196, 6, 154, 'Whwhmqkq', '164205043361dfb381e49fe', '1', NULL, NULL, '2022-01-13 05:07:13', '2022-01-13 05:07:13', NULL),
(197, 17, 192, 'Hbb', '164207173661e006b8abb07', '1', NULL, NULL, '2022-01-13 11:02:16', '2022-01-13 11:02:16', NULL),
(198, 17, 193, 'Ggyy', '164226977961e30c53db380', '1', NULL, NULL, '2022-01-15 18:02:59', '2022-01-15 18:02:59', NULL),
(199, 21, 212, '4', '164239627561e4fa7358150', '1', NULL, NULL, '2022-01-17 05:11:15', '2022-01-17 05:11:15', NULL),
(200, 26, 289, 'Rcrc', '164274166161ea3f9ddb314', '1', NULL, NULL, '2022-01-21 05:07:41', '2022-01-21 05:07:47', '2022-01-21 05:07:47'),
(201, 17, 314, 'Xrd', '164275955061ea857e23335', '1', NULL, NULL, '2022-01-21 10:05:50', '2022-01-21 10:05:50', NULL),
(202, 31, 336, 'Bk', '164302380761ee8dbf4834a', '1', NULL, NULL, '2022-01-24 11:30:07', '2022-01-24 11:30:07', NULL),
(203, 30, 330, 'Vhgg', '164302383261ee8dd89b9ec', '1', NULL, NULL, '2022-01-24 11:30:32', '2022-01-24 11:30:32', NULL),
(204, 30, 330, 'Vhgg', '164302383461ee8dda04920', '1', NULL, NULL, '2022-01-24 11:30:34', '2022-01-24 11:30:34', NULL),
(205, 30, 330, 'Vhgg', '164302383861ee8ddeb2bcf', '1', NULL, NULL, '2022-01-24 11:30:38', '2022-01-24 11:30:38', NULL),
(206, 30, 330, 'Vhgg', '164302383961ee8ddff062e', '1', NULL, NULL, '2022-01-24 11:30:39', '2022-01-24 11:30:39', NULL),
(207, 30, 329, 'Fthh', '164302459061ee90ceba690', '1', NULL, NULL, '2022-01-24 11:43:10', '2022-01-24 13:11:28', '2022-01-24 13:11:28'),
(208, 30, 329, 'Fthh', '164302459261ee90d05a821', '1', NULL, NULL, '2022-01-24 11:43:12', '2022-01-24 11:43:12', NULL),
(209, 31, 335, 'Bhmb', '164302469261ee913476ff4', '1', NULL, NULL, '2022-01-24 11:44:52', '2022-01-24 11:44:52', NULL),
(210, 30, 331, 'Qqqq', '164302473061ee915ac8015', '1', NULL, NULL, '2022-01-24 11:45:30', '2022-01-24 11:45:30', NULL),
(211, 30, 331, 'Qqqq', '164302473261ee915c127ba', '1', NULL, NULL, '2022-01-24 11:45:32', '2022-01-24 11:45:32', NULL),
(212, 28, 346, 'Ghh', '164303335761eeb30d2d92b', '1', NULL, NULL, '2022-01-24 14:09:17', '2022-01-24 14:09:17', NULL),
(213, 28, 346, 'Ghh', '164303336461eeb31499269', '1', NULL, NULL, '2022-01-24 14:09:24', '2022-01-24 14:09:24', NULL),
(214, 28, 346, 'Ghh', '164303336761eeb317a5746', '1', NULL, NULL, '2022-01-24 14:09:27', '2022-01-24 14:09:27', NULL),
(215, 28, 346, 'Ghh', '164303336961eeb31914259', '1', NULL, NULL, '2022-01-24 14:09:29', '2022-01-24 14:09:32', '2022-01-24 14:09:32'),
(216, 28, 349, 'Hhh', '164303348361eeb38b5949c', '1', NULL, NULL, '2022-01-24 14:11:23', '2022-01-24 14:21:06', '2022-01-24 14:21:06'),
(217, 28, 349, 'Hhhn', '164303350461eeb3a09ae3d', '1', NULL, NULL, '2022-01-24 14:11:44', '2022-01-24 14:21:11', '2022-01-24 14:21:11'),
(218, 28, 349, 'Hhhn', '164303350561eeb3a1f126e', '1', NULL, NULL, '2022-01-24 14:11:45', '2022-01-24 14:42:15', '2022-01-24 14:42:15'),
(219, 17, 415, 'ggh', '164310742561efd461af893', '1', NULL, NULL, '2022-01-25 10:43:45', '2022-01-25 11:02:13', '2022-01-25 11:02:13'),
(220, 17, 415, 'ggh', '164310746261efd4867d714', '1', NULL, NULL, '2022-01-25 10:44:22', '2022-01-25 10:44:22', NULL),
(221, 17, 415, 'ggh', '164310746461efd48898b3a', '1', NULL, NULL, '2022-01-25 10:44:24', '2022-01-25 10:44:24', NULL),
(222, 17, 414, 'bbbb', '164310756461efd4ecd15f5', '1', NULL, NULL, '2022-01-25 10:46:04', '2022-01-25 10:46:04', NULL),
(223, 17, 414, 'bbbbhshhss', '164310759561efd50be51f4', '1', NULL, NULL, '2022-01-25 10:46:35', '2022-01-25 10:46:35', NULL),
(224, 17, 414, 'bbbbhshhsswze wxw', '164310761061efd51a65878', '1', NULL, NULL, '2022-01-25 10:46:50', '2022-01-25 10:46:50', NULL),
(225, 17, 414, 'bbbbhshhsswze wxw', '164310761661efd520ce67b', '1', NULL, NULL, '2022-01-25 10:46:56', '2022-01-25 10:46:56', NULL),
(226, 6, 146, 'Dasd', '164310879261efd9b813209', '1', NULL, NULL, '2022-01-25 11:06:32', '2022-01-25 11:06:32', NULL),
(227, 6, 419, 'Sdsa', '164310944761efdc47044ba', '1', NULL, NULL, '2022-01-25 11:17:27', '2022-01-25 11:17:27', NULL),
(228, 32, 428, 'bsbdbdh', '164312296761f01117a5f72', '1', NULL, NULL, '2022-01-25 15:02:47', '2022-01-25 15:02:47', NULL),
(229, 32, 428, 'bsbdbdh', '164312297261f0111c9d2c8', '1', NULL, NULL, '2022-01-25 15:02:52', '2022-01-25 15:02:57', '2022-01-25 15:02:57'),
(230, 32, 428, 'bsbdbdh', '164312297361f0111dbe694', '1', NULL, NULL, '2022-01-25 15:02:53', '2022-01-25 15:02:53', NULL),
(231, 33, 525, 'Yh', '164319016161f11791b75d8', '1', NULL, NULL, '2022-01-26 09:42:41', '2022-01-26 09:42:41', NULL),
(232, 17, 544, 'Ddd', '164319323361f1239151954', '1', NULL, NULL, '2022-01-26 10:33:53', '2022-01-26 10:33:53', NULL),
(233, 17, 572, 'Zhzjz', '164326511561f23c5b3ebe3', '1', NULL, NULL, '2022-01-27 06:31:55', '2022-01-27 06:31:55', NULL),
(234, 17, 571, 'Zhzjzshshsh', '164326512761f23c67491ac', '1', NULL, NULL, '2022-01-27 06:32:07', '2022-01-27 06:33:17', '2022-01-27 06:33:17'),
(235, 17, 571, 'Zhzjzshshsh', '164326513161f23c6be8870', '1', NULL, NULL, '2022-01-27 06:32:11', '2022-01-27 06:33:21', '2022-01-27 06:33:21'),
(236, 17, 571, 'Zhzjzshshsh', '164326513661f23c70227f4', '1', NULL, NULL, '2022-01-27 06:32:16', '2022-01-27 06:32:16', NULL),
(237, 37, 670, 'Tat', '164334388361f3700b9673c', '1', NULL, NULL, '2022-01-28 04:24:43', '2022-01-28 04:24:43', NULL),
(238, 37, 672, 'As', '164334429561f371a7b9c93', '1', NULL, NULL, '2022-01-28 04:31:35', '2022-01-28 04:31:35', NULL),
(239, 37, 674, 'Asnzwjxhw', '164334431861f371bed9a17', '1', NULL, NULL, '2022-01-28 04:31:58', '2022-01-28 04:32:03', '2022-01-28 04:32:03'),
(240, 37, 673, 'Asnzwjxhw', '164334443361f3723179eac', '1', NULL, NULL, '2022-01-28 04:33:53', '2022-01-28 04:33:53', NULL),
(241, 37, 673, 'Asnzwjxhw', '164334443761f37235decb1', '1', NULL, NULL, '2022-01-28 04:33:57', '2022-01-28 04:33:57', NULL),
(242, 37, 673, 'Asnzwjxhw', '164334444161f372395a17e', '1', NULL, NULL, '2022-01-28 04:34:01', '2022-01-28 04:34:01', NULL),
(243, 37, 682, 'Tt', '164334514661f374faed82b', '1', NULL, NULL, '2022-01-28 04:45:46', '2022-01-28 04:45:46', NULL),
(244, 37, 683, 'Tt', '164334515361f37501e0a3f', '1', NULL, NULL, '2022-01-28 04:45:53', '2022-01-28 04:45:53', NULL),
(245, 37, 683, 'Tt4n5un7', '164334515961f375079f3a1', '1', NULL, NULL, '2022-01-28 04:45:59', '2022-01-28 04:45:59', NULL),
(246, 37, 684, 'Tt4n5un7', '164334516661f3750e194ad', '1', NULL, NULL, '2022-01-28 04:46:06', '2022-01-28 04:46:06', NULL),
(247, 36, 737, 'UU', '164337903061f3f9565b884', '1', NULL, NULL, '2022-01-28 14:10:30', '2022-01-28 14:10:37', '2022-01-28 14:10:37'),
(248, 36, 737, 'UU', '164337904561f3f9656c39a', '1', NULL, NULL, '2022-01-28 14:10:45', '2022-01-28 14:10:49', '2022-01-28 14:10:49'),
(249, 39, 742, 'bxbxbzbdb', '164338198561f404e14b9c1', '1', NULL, NULL, '2022-01-28 14:59:45', '2022-01-28 14:59:45', NULL),
(250, 39, 743, 'Gubc', '164338334261f40a2ea113b', '1', NULL, NULL, '2022-01-28 15:22:22', '2022-01-28 15:22:22', NULL),
(251, 38, 743, 'Hchcch', '164338336361f40a43adcb2', '1', NULL, NULL, '2022-01-28 15:22:43', '2022-01-28 15:22:43', NULL),
(252, 37, 772, 'Gcg', '164361148961f78561a9b7b', '1', NULL, NULL, '2022-01-31 06:44:49', '2022-01-31 06:44:49', NULL),
(253, 39, 743, 'bdbdbd', '164361396061f78f0853d0e', '1', NULL, NULL, '2022-01-31 07:26:00', '2022-01-31 07:26:00', NULL),
(254, 39, 750, 'bdbdbd', '164361397061f78f122d004', '1', NULL, NULL, '2022-01-31 07:26:10', '2022-01-31 07:26:10', NULL),
(255, 39, 748, 'bdbdbd', '164361398161f78f1d558fb', '1', NULL, NULL, '2022-01-31 07:26:21', '2022-01-31 07:26:21', NULL),
(256, 39, 748, 'bdbdbd', '164361398661f78f22ee829', '1', NULL, NULL, '2022-01-31 07:26:26', '2022-01-31 07:26:26', NULL),
(257, 39, 748, 'bdbdbd', '164361399061f78f265d046', '1', NULL, NULL, '2022-01-31 07:26:30', '2022-01-31 07:26:30', NULL),
(258, 39, 742, 'bdbdbd', '164361400361f78f33f20c2', '1', NULL, NULL, '2022-01-31 07:26:43', '2022-01-31 07:26:43', NULL),
(259, 39, 742, 'bdbdbd', '164361400861f78f38076a2', '1', NULL, NULL, '2022-01-31 07:26:48', '2022-01-31 07:26:48', NULL),
(260, 39, 779, 'bdbdb', '164361414861f78fc41db81', '1', NULL, NULL, '2022-01-31 07:29:08', '2022-01-31 07:29:08', NULL),
(261, 39, 779, 'bdbdb', '164361416161f78fd190541', '1', NULL, NULL, '2022-01-31 07:29:21', '2022-01-31 07:38:50', '2022-01-31 07:38:50'),
(262, 39, 780, 'gghg', '164361472661f792061116a', '1', NULL, NULL, '2022-01-31 07:38:46', '2022-01-31 07:38:46', NULL),
(263, 39, 780, 'gghg', '164361473661f79210e1a02', '1', NULL, NULL, '2022-01-31 07:38:56', '2022-01-31 07:43:04', '2022-01-31 07:43:04'),
(264, 39, 781, 'gg', '164361478261f7923e708ae', '1', NULL, NULL, '2022-01-31 07:39:42', '2022-01-31 07:39:42', NULL),
(265, 39, 790, 'vgg', '164361560261f795729aa9c', '1', NULL, NULL, '2022-01-31 07:53:22', '2022-01-31 07:53:22', NULL),
(266, 37, 736, 'Cff', '164361658061f79944b24c4', '1', NULL, NULL, '2022-01-31 08:09:40', '2022-01-31 08:09:40', NULL),
(267, 37, 736, 'Cff', '164361658561f79949e2604', '1', NULL, NULL, '2022-01-31 08:09:45', '2022-01-31 08:09:45', NULL),
(268, 37, 736, 'Hcu', '164361660061f799588c272', '1', NULL, NULL, '2022-01-31 08:10:00', '2022-01-31 08:10:00', NULL),
(269, 37, 692, 'Vggg', '164361662761f79973e41e5', '1', NULL, NULL, '2022-01-31 08:10:27', '2022-01-31 08:10:27', NULL),
(270, 37, 735, 'Ggsgz', '164368816361f8b0e36e757', '1', NULL, NULL, '2022-02-01 04:02:43', '2022-02-01 04:02:43', NULL),
(271, 37, 736, 'Fff', '164368966661f8b6c298a9c', '1', NULL, NULL, '2022-02-01 04:27:46', '2022-02-01 04:29:13', '2022-02-01 04:29:13'),
(272, 37, 736, 'Fff', '164368967761f8b6cdc9bb9', '1', NULL, NULL, '2022-02-01 04:27:57', '2022-02-01 04:29:08', '2022-02-01 04:29:08'),
(273, 37, 792, 'Kljkj', '164368968961f8b6d9e0c64', '1', NULL, NULL, '2022-02-01 04:28:09', '2022-02-01 04:28:09', NULL),
(274, 37, 801, 'Fggg', '164369623861f8d06e3c58c', '1', NULL, NULL, '2022-02-01 06:17:18', '2022-02-01 06:17:18', NULL),
(275, 37, 832, 'Bb', '164369696461f8d344eb19e', '1', NULL, NULL, '2022-02-01 06:29:24', '2022-02-01 07:33:11', '2022-02-01 07:33:11'),
(276, 37, 829, 'Ccc', '164369702761f8d3835409c', '1', NULL, NULL, '2022-02-01 06:30:27', '2022-02-01 06:30:31', '2022-02-01 06:30:31'),
(277, 42, 846, 'Hgsh', '164370245661f8e8b87dee7', '1', NULL, NULL, '2022-02-01 08:00:56', '2022-02-01 08:00:56', NULL),
(278, 42, 848, 'Hgsh', '164370247261f8e8c842664', '1', NULL, NULL, '2022-02-01 08:01:12', '2022-02-01 08:01:12', NULL),
(279, 42, 845, 'Hgsh', '164370248761f8e8d79317d', '1', NULL, NULL, '2022-02-01 08:01:27', '2022-02-01 08:01:27', NULL),
(280, 42, 848, 'Hgsh', '164370250061f8e8e47ee1e', '1', NULL, NULL, '2022-02-01 08:01:40', '2022-02-01 08:01:40', NULL),
(281, 42, 848, 'Hgsh', '164370250661f8e8ea8d34b', '1', NULL, NULL, '2022-02-01 08:01:46', '2022-02-01 08:01:46', NULL),
(282, 42, 848, 'Hhgdf', '164370251661f8e8f4615c1', '1', NULL, NULL, '2022-02-01 08:01:56', '2022-02-01 08:01:56', NULL),
(283, 36, 737, 'Fcc', '164370320661f8eba66833d', '1', NULL, NULL, '2022-02-01 08:13:26', '2022-02-01 08:18:28', '2022-02-01 08:18:28'),
(284, 42, 854, 'Gj', '164370375961f8edcf530b3', '1', NULL, NULL, '2022-02-01 08:22:39', '2022-02-01 08:22:39', NULL),
(285, 36, 764, 'A,,q', '164370473561f8f19f48b76', '1', NULL, NULL, '2022-02-01 08:38:55', '2022-02-01 08:39:50', '2022-02-01 08:39:50'),
(286, 36, 762, '5t', '164371225361f90efd6fd3c', '1', NULL, NULL, '2022-02-01 10:44:13', '2022-02-01 10:45:10', '2022-02-01 10:45:10'),
(287, 36, 761, 'Gff', '164371386461f91548f290f', '1', NULL, NULL, '2022-02-01 11:11:04', '2022-02-01 11:11:04', NULL),
(288, 36, 878, 'Gufu', '16442972886201fc48e3cfd', '1', NULL, NULL, '2022-02-08 05:14:48', '2022-02-08 05:14:48', NULL),
(289, 36, 878, 'Gufu', '16442972936201fc4d777e9', '1', NULL, NULL, '2022-02-08 05:14:53', '2022-02-08 05:14:53', NULL),
(290, 36, 875, 'Ggg', '16443005996202093756a9a', '1', NULL, NULL, '2022-02-08 06:09:59', '2022-02-08 06:09:59', NULL),
(291, 36, 875, 'Gggcicy8', '164430060962020941c5cea', '1', NULL, NULL, '2022-02-08 06:10:09', '2022-02-08 06:10:09', NULL),
(292, 36, 909, 'Nnzsnd', '164430365062021522093d8', '1', NULL, NULL, '2022-02-08 07:00:50', '2022-02-08 07:00:50', NULL),
(293, 36, 958, 'F8g', '164431741162024ae30a4d6', '1', NULL, NULL, '2022-02-08 10:50:11', '2022-02-08 11:03:23', '2022-02-08 11:03:23'),
(294, 36, 959, 'F8gigdt', '164431744662024b0613025', '1', NULL, NULL, '2022-02-08 10:50:46', '2022-02-08 11:13:48', '2022-02-08 11:13:48'),
(295, 36, 958, 'F8gigdt', '164431745762024b11d6ef0', '1', NULL, NULL, '2022-02-08 10:50:57', '2022-02-09 04:16:39', '2022-02-09 04:16:39'),
(296, 36, 954, 'Fff', '1644319337620252691be03', '1', NULL, NULL, '2022-02-08 11:22:17', '2022-02-08 11:22:17', NULL),
(297, 13, 159, 'Lunch', '1644327896620273d81cd11', '1', NULL, NULL, '2022-02-08 13:44:56', '2022-02-08 13:45:17', '2022-02-08 13:45:17'),
(298, 36, 959, 'Jjk', '16443809566203431c33835', '1', NULL, NULL, '2022-02-09 04:29:16', '2022-02-09 04:29:16', NULL),
(299, 36, 959, 'Jjk', '16443809616203432141496', '1', NULL, NULL, '2022-02-09 04:29:21', '2022-02-14 05:42:56', '2022-02-14 05:42:56'),
(300, 50, 1019, 'Gggg', '165779449562cfefbf4131a', '1', NULL, NULL, '2022-07-14 14:28:15', '2022-07-14 14:30:54', '2022-07-14 14:30:54'),
(301, 50, 1019, 'Gggg', '165779451262cfefd006484', '1', NULL, NULL, '2022-07-14 14:28:32', '2022-07-14 14:28:32', NULL),
(302, 50, 1018, 'Lkjh', '165779472262cff0a2f33b5', '1', NULL, NULL, '2022-07-14 14:32:02', '2022-07-14 15:01:42', '2022-07-14 15:01:42'),
(303, 50, 1018, 'Lkjh', '165779491962cff1672162a', '1', NULL, NULL, '2022-07-14 14:35:19', '2022-07-14 14:35:19', NULL),
(304, 50, 1071, 'Yyyyy', '165786097962d0f373bb7a1', '1', NULL, NULL, '2022-07-15 08:56:19', '2022-07-15 09:00:22', '2022-07-15 09:00:22'),
(305, 50, 1071, 'Yyyyy', '165786100162d0f3892d2b6', '1', NULL, NULL, '2022-07-15 08:56:41', '2022-07-15 08:56:41', NULL),
(306, 53, 1347, 'Hssh', '165848551862da7b0e423e6', '1', NULL, NULL, '2022-07-22 14:25:18', '2022-07-22 14:25:18', NULL),
(307, 53, 1347, 'Hssh', '165848552762da7b17ad7ec', '1', NULL, NULL, '2022-07-22 14:25:27', '2022-07-22 14:25:27', NULL),
(308, 28, 1392, 'Bdhd', '165873853162de5763a6e94', '1', NULL, NULL, '2022-07-25 12:42:11', '2022-07-25 14:05:31', '2022-07-25 14:05:31'),
(309, 28, 1392, 'Bdhd', '165873855462de577a6e247', '1', NULL, NULL, '2022-07-25 12:42:34', '2022-07-25 12:44:04', '2022-07-25 12:44:04'),
(310, 28, 1393, 'Bdhd', '165873856662de578661701', '1', NULL, NULL, '2022-07-25 12:42:46', '2022-07-25 12:42:46', NULL),
(311, 28, 1386, 'Bdhd', '165873866262de57e60b44f', '1', NULL, NULL, '2022-07-25 12:44:22', '2022-07-25 12:55:14', '2022-07-25 12:55:14'),
(312, 28, 1386, 'Bdhd', '165873921362de5a0d5732b', '1', NULL, NULL, '2022-07-25 12:53:33', '2022-07-25 12:53:33', NULL),
(313, 28, 1407, 'Bdhd', '165873958562de5b81e2ac1', '1', NULL, NULL, '2022-07-25 12:59:45', '2022-07-25 12:59:45', NULL),
(314, 28, 1387, 'Vhbvg', '165874345062de6a9a28c57', '1', NULL, NULL, '2022-07-25 14:04:10', '2022-07-25 14:04:10', NULL),
(315, 55, 1434, 'Hshdhd', '165875468862de9680b19e8', '1', NULL, NULL, '2022-07-25 17:11:28', '2022-07-25 17:11:28', NULL),
(316, 57, 1460, 'Dsad', '165890352262e0dbe273d02', '1', NULL, NULL, '2022-07-27 10:32:02', '2022-07-27 10:32:02', NULL),
(317, 57, 1463, 'Sdas', '165890557962e0e3eb0433b', '1', NULL, NULL, '2022-07-27 11:06:19', '2022-07-27 11:11:40', '2022-07-27 11:11:40'),
(318, 57, 1463, 'Sdas', '165890562662e0e41a73e5f', '1', NULL, NULL, '2022-07-27 11:07:06', '2022-07-27 11:11:44', '2022-07-27 11:11:44'),
(319, 57, 1463, 'Sdas', '165890580262e0e4ca01a65', '1', '2047-07-27 , 12:06:55 am', '2022-07-27 , 10:06:43 pm', '2022-07-27 11:10:02', '2022-07-27 11:10:02', NULL),
(320, 57, 1465, 'Okay', '165890601462e0e59e823f9', '1', '2032-10-25 , 12:13:13 am', '2022-07-27 , 9:13:26 am', '2022-07-27 11:13:34', '2022-07-27 11:13:34', NULL),
(321, 57, 1465, 'Okay', '165890612262e0e60a36a8b', '1', '2032-10-25 , 12:13:13 am', '2022-07-27 , 9:13:26 am', '2022-07-27 11:15:22', '2022-07-27 11:15:22', NULL),
(322, 54, 1385, 'First', '165890619962e0e65755fd9', '1', '2023-03-04 , 12:16:23 pm', '2022-07-27 , 3:16:18 pm', '2022-07-27 11:16:39', '2022-07-27 11:16:39', NULL),
(323, 57, 1463, 'Yyy', '165890631362e0e6c95c367', '1', '2024-08-01 , 12:18:13 pm', '2022-07-27 , 3:00:23 pm', '2022-07-27 11:18:33', '2022-07-27 11:18:33', NULL),
(324, 57, 1463, 'Pp', '165890687762e0e8fdce16a', '1', '01-07-2026 , 12:27:40 pm', '27-07-2022 , 9:00:50 pm', '2022-07-27 11:27:57', '2022-07-27 11:27:57', NULL),
(325, 57, 1463, 'New', '165890727562e0ea8b0ba41', '1', '01-07-2036 , 12:34:24 pm', '27-07-2022 , 11:00:17 pm', '2022-07-27 11:34:35', '2022-07-27 11:34:35', NULL),
(326, 57, 1464, 'Dsa', '165890733262e0eac46e08c', '1', '27-07-2013 , 12:35:18 am', '27-07-2022 , 2:35:23 pm', '2022-07-27 11:35:32', '2022-07-27 11:35:32', NULL),
(327, 57, 1471, 'Ds', '165890747762e0eb55795d1', '1', '27-07-2022 , 12:37 am', '27-07-2022 , 12:37 am', '2022-07-27 11:37:57', '2022-07-27 14:17:19', '2022-07-27 14:17:19'),
(328, 57, 1471, 'Ds', '165890748962e0eb61d8ab4', '1', '27-07-2022 , 12:37 am', '27-07-2022 , 7:38 pm', '2022-07-27 11:38:09', '2022-07-27 11:38:09', NULL),
(329, 57, 1471, 'Create', '165890760362e0ebd338a52', '1', '04-02-2022 , 12:39 pm', '27-07-2022 , 3:59 pm', '2022-07-27 11:40:03', '2022-07-27 11:40:03', NULL),
(330, 57, 1472, 'Nn', '165890865562e0efefd15da', '1', '07-07-2022 , 12:57 pm', '27-07-2022 , 3:57 pm', '2022-07-27 11:57:35', '2022-07-27 11:57:35', NULL),
(331, 57, 1472, 'Vbv', '165890920262e0f212eee42', '1', '27-07-2022 , 1:06 pm', '27-07-2022 , 1:06 pm', '2022-07-27 12:06:42', '2022-07-27 12:06:42', NULL),
(332, 57, 1472, 'Ffff', '165890935562e0f2ab3342d', '1', '27-07-2022 , 1:05 am', '27-07-2022 , 1:05 am', '2022-07-27 12:09:15', '2022-07-27 12:09:15', NULL),
(333, 57, 1472, 'Ffff.', '165890936462e0f2b4bf14a', '1', '27-07-2022 , 1:05 am', '27-07-2022 , 1:05 am', '2022-07-27 12:09:24', '2022-07-27 12:09:24', NULL),
(334, 57, 1471, 'Www', '165891705462e110bed6fd7', '1', '27-07-2022 , 3:17 am', '27-07-2022 , 3:17 am', '2022-07-27 14:17:34', '2022-07-27 14:17:34', NULL),
(335, 63, 2088, 'Sad', '165933691062e778ce5ef80', '1', '31-07-2022 , 11:55 pm', '31-07-2022 , 1:55 am', '2022-08-01 10:55:10', '2022-08-01 10:55:10', NULL),
(336, 48, 2097, 'Shhs', '165933698862e7791cd4bfa', '1', '04-08-2022 , 11:56 pm', '31-07-2022 , 11:56 am', '2022-08-01 10:56:28', '2022-08-01 10:56:28', NULL),
(337, 48, 2100, 'New', '165933704762e77957b8a52', '1', '04-08-2022 , 11:56 pm', '31-07-2022 , 11:56 am', '2022-08-01 10:57:27', '2022-08-01 10:57:27', NULL),
(338, 48, 2101, 'New', '165933705662e77960c98fa', '1', '04-08-2022 , 11:56 pm', '31-07-2022 , 11:56 am', '2022-08-01 10:57:36', '2022-08-01 10:57:36', NULL),
(339, 48, 2096, 'New', '165933706862e7796c49450', '1', '05-08-2022 , 11:57 pm', '31-07-2022 , 11:56 am', '2022-08-01 10:57:48', '2022-08-01 10:57:48', NULL),
(340, 48, 2103, 'New', '165933722662e77a0ac63a3', '1', '05-08-2022 , 11:57 pm', '31-07-2022 , 11:56 am', '2022-08-01 11:00:26', '2022-08-01 11:00:31', '2022-08-01 11:00:31'),
(341, 48, 2100, 'Newhfu', '165933725662e77a2863d95', '1', '05-08-2022 , 11:57 pm', '31-07-2022 , 11:56 am', '2022-08-01 11:00:56', '2022-08-01 11:01:13', '2022-08-01 11:01:13'),
(342, 48, 2134, '123', '165933958862e7834438609', '1', '31-08-2022 , 12:39 am', '01-08-2022 , 7:39 pm', '2022-08-01 11:39:48', '2022-08-01 11:40:55', '2022-08-01 11:40:55'),
(343, 48, 2135, '1234', '165933961862e78362b1e7e', '1', '28-08-2022 , 12:40 am', '01-08-2022 , 10:59 pm', '2022-08-01 11:40:18', '2022-08-01 11:40:18', NULL),
(344, 62, 1937, 'Aaa', '165936241762e7dc71b23cf', '1', '18-08-2022 , 7:00 pm', '01-08-2022 , 10:00 pm', '2022-08-01 18:00:17', '2022-08-01 18:00:17', NULL),
(345, 62, 2460, 'Aaa', '165936541362e7e82579bba', '1', '26-08-2022 , 7:50 pm', '01-08-2022 , 7:50 pm', '2022-08-01 18:50:13', '2022-08-01 18:50:13', NULL),
(346, 62, 2459, 'Aaa', '165936542862e7e83497c52', '1', '26-08-2022 , 7:50 pm', '01-08-2022 , 7:50 pm', '2022-08-01 18:50:28', '2022-08-01 18:50:28', NULL),
(347, 62, 2458, 'Hfhchc', '165936572862e7e9607d27b', '1', '07-08-2022 , 7:55 pm', '01-08-2022 , 5:00 pm', '2022-08-01 18:55:28', '2022-08-01 18:55:28', NULL),
(348, 48, 2426, 'Uj', '165941456262e8a82283f3b', '1', '02-08-2022 , 9:29 am', '02-08-2022 , 9:29 am', '2022-08-02 08:29:22', '2022-08-02 08:29:22', NULL),
(349, 48, 2425, 'Gg', '165941463062e8a8661070d', '1', '02-08-2022 , 9:30 am', '02-08-2022 , 9:30 am', '2022-08-02 08:30:30', '2022-08-02 08:30:30', NULL),
(350, 48, 2425, 'Hh', '165941467862e8a896001cd', '1', '02-08-2022 , 9:31 am', '02-08-2022 , 9:31 pm', '2022-08-02 08:31:18', '2022-08-02 08:31:18', NULL),
(351, 48, 2476, 'Jjh', '165941536762e8ab4765b7f', '1', '02-08-2022 , 9:42 am', '02-08-2022 , 9:42 am', '2022-08-02 08:42:47', '2022-08-02 08:42:47', NULL),
(352, 61, 2618, 'Ey', '165942616662e8d576649e6', '1', '02-08-2022 , 12:42 pm', '02-08-2022 , 12:42 pm', '2022-08-02 11:42:46', '2022-08-02 11:45:54', '2022-08-02 11:45:54'),
(353, 48, 3039, 'Jasj', '165950428062ea0698cce77', '1', '03-08-2022 , 10:24 am', '03-08-2022 , 10:24 am', '2022-08-03 09:24:40', '2022-08-03 09:24:47', '2022-08-03 09:24:47'),
(354, 48, 3039, 'Jasj', '165950438962ea0705bbbd2', '1', '03-08-2022 , 10:24 am', '03-08-2022 , 10:24 am', '2022-08-03 09:26:29', '2022-08-03 09:26:29', NULL),
(355, 48, 3039, 'Jasj', '165950439762ea070df162c', '1', '03-08-2022 , 10:24 am', '03-08-2022 , 10:24 am', '2022-08-03 09:26:37', '2022-08-03 09:26:37', NULL),
(356, 54, 3047, 'Das', '165950468762ea082f98e7c', '1', '02-08-2022 , 10:31 pm', '02-08-2022 , 10:31 pm', '2022-08-03 09:31:27', '2022-08-03 09:31:27', NULL),
(357, 48, 3353, '1', '165951676862ea37601a3dc', '1', '20-08-2022 , 1:52 pm', '03-08-2022 , 6:15 pm', '2022-08-03 12:52:48', '2022-08-03 12:54:24', '2022-08-03 12:54:24'),
(358, 62, 3370, 'Hdhd', '165951793662ea3bf097c00', '1', '03-08-2031 , 2:12 pm', '03-08-2022 , 2:03 pm', '2022-08-03 13:12:16', '2022-08-03 13:12:16', NULL),
(359, 62, 3370, 'Hdhd', '165951802762ea3c4b73539', '1', '03-08-2031 , 2:12 pm', '03-08-2022 , 2:03 pm', '2022-08-03 13:13:47', '2022-08-03 13:14:21', '2022-08-03 13:14:21'),
(360, 62, 3370, 'Hdhd', '165951803762ea3c558e6aa', '1', '03-08-2031 , 2:12 pm', '03-08-2022 , 2:03 pm', '2022-08-03 13:13:57', '2022-08-03 13:13:57', NULL),
(361, 62, 3370, 'Hdhd', '165951804562ea3c5ded093', '1', '03-08-2031 , 2:12 pm', '03-08-2022 , 2:03 pm', '2022-08-03 13:14:05', '2022-08-03 13:14:15', '2022-08-03 13:14:15'),
(362, 61, 3381, '1', '165951959162ea426710f9c', '1', '03-08-2022 , 2:39 pm', '03-08-2022 , 5:39 pm', '2022-08-03 13:39:51', '2022-08-03 13:39:51', NULL),
(363, 61, 3381, '1', '165951959662ea426c9d7c9', '1', '03-08-2022 , 2:39 pm', '03-08-2022 , 5:39 pm', '2022-08-03 13:39:56', '2022-08-03 13:39:56', NULL),
(364, 13, 180, 'Day 1', '165985853562ef6e6790ca0', '1', '09-08-2022 , 11:48 am', '07-08-2022 , 6:00 am', '2022-08-07 11:48:55', '2022-08-07 11:49:10', '2022-08-07 11:49:10'),
(365, 45, 3429, 'Bbb', '1664967409633d62f17325a', '1', '05-10-2022 , 3:56 pm', '05-10-2022 , 3:56 pm', '2022-10-05 14:56:49', '2022-10-05 14:56:49', NULL),
(366, 45, 3442, 'Znzn', '1664969976633d6cf801e25', '1', '05-10-2022 , 4:39 pm', '05-10-2022 , 4:39 pm', '2022-10-05 15:39:36', '2022-10-07 10:53:17', '2022-10-07 10:53:17'),
(367, 67, 3449, 'Yyyy', '16653904076343d7475723f', '1', '10-10-2022 , 1:26 pm', '10-10-2022 , 1:26 pm', '2022-10-10 12:26:47', '2023-05-03 13:41:46', '2023-05-03 13:41:46'),
(368, 68, 3495, 'Aaa', '166548551763454acd9dc75', '1', '11-10-2022 , 3:51 pm', '11-10-2022 , 3:51 pm', '2022-10-11 14:51:57', '2022-10-11 14:51:57', NULL),
(369, 68, 3498, 'Vggg', '166548563263454b40e8138', '1', '11-10-2022 , 5:53 am', '11-10-2022 , 5:53 am', '2022-10-11 14:53:52', '2022-10-11 14:53:52', NULL),
(370, 68, 3498, 'Vggg', '166548563763454b4588854', '1', '11-10-2022 , 5:53 am', '11-10-2022 , 5:53 am', '2022-10-11 14:53:57', '2022-10-11 14:53:57', NULL),
(371, 13, 3509, 'Lunch', '167396531263c6af006caf1', '1', '17-01-2023 , 6:21 pm', '17-01-2023 , 6:21 pm', '2023-01-17 19:21:52', '2023-01-17 19:21:52', NULL),
(372, 69, 3522, 'Lunch', '1682012437644179150e157', '1', '20-04-2023 , 9:40 pm', '20-04-2023 , 9:40 pm', '2023-04-20 21:40:37', '2023-04-20 21:42:58', '2023-04-20 21:42:58'),
(373, 69, 3525, 'Move location', '16820125256441796d24683', '1', '27-04-2023 , 9:41 pm', '20-04-2023 , 11:41 pm', '2023-04-20 21:42:05', '2023-04-20 21:43:47', '2023-04-20 21:43:47'),
(374, 69, 3528, 'Linch', '1682508229644909c5f1f82', '1', '26-04-2023 , 3:23 pm', '26-04-2023 , 3:23 pm', '2023-04-26 15:23:49', '2023-04-26 15:23:49', NULL),
(375, 69, 3528, 'Jdjdj', '16825109736449147d138d3', '1', '26-04-2023 , 3:23 pm', '26-04-2023 , 3:23 pm', '2023-04-26 16:09:33', '2023-04-26 16:09:45', '2023-04-26 16:09:45'),
(376, 70, 3566, 'Breakk', '1683184109645359ed137b5', '1', '04-05-2023 , 12:08 pm', '04-05-2023 , 12:08 pm', '2023-05-04 11:08:29', '2023-05-04 11:08:29', NULL);
INSERT INTO `breaks` (`id`, `user_id`, `scene_id`, `name`, `slug`, `status`, `date`, `time`, `created_at`, `updated_at`, `deleted_at`) VALUES
(377, 68, 3578, 'Qqww', '16831991096453948547887', '1', '04-05-2023 , 4:18 pm', '04-05-2023 , 4:18 pm', '2023-05-04 15:18:29', '2023-05-04 15:37:03', '2023-05-04 15:37:03'),
(378, 68, 3639, 'Lunch time', '16835447586458dab6572fb', '1', '08-05-2023 , 4:19 pm', '08-05-2023 , 4:19 pm', '2023-05-08 15:19:18', '2023-05-08 15:46:04', '2023-05-08 15:46:04'),
(379, 28, 3568, 'Xx', '1683800738645cc2a24d588', '1', '11-05-2023 , 3:25 pm', '11-05-2023 , 3:25 pm', '2023-05-11 14:25:38', '2023-05-11 14:25:38', NULL),
(380, 68, 3670, 'Lunch', '16843973996465dd57a21f9', '1', '18-05-2023 , 1:09 pm', '18-05-2023 , 1:09 pm', '2023-05-18 12:09:59', '2023-05-18 12:09:59', NULL),
(381, 68, 3677, 'Xzx', '16843980746465dffa94a73', '1', '18-05-2023 , 1:20 pm', '18-05-2023 , 1:30 pm', '2023-05-18 12:21:14', '2023-05-18 12:21:14', NULL),
(382, 45, 3678, 'Nnn', '16844057156465fdd3b64ca', '1', '18-05-2023 , 3:28 pm', '18-05-2023 , 3:28 pm', '2023-05-18 14:28:35', '2023-05-18 14:28:35', NULL),
(383, 68, 3690, 'Gfg', '168440973264660d848df7c', '1', '18-05-2023 , 4:35 pm', '18-05-2023 , 4:35 pm', '2023-05-18 15:35:32', '2023-05-18 15:35:32', NULL);

-- --------------------------------------------------------

--
-- Table structure for table `cms_modules`
--

CREATE TABLE `cms_modules` (
  `id` bigint(20) UNSIGNED NOT NULL,
  `parent_id` int(11) NOT NULL DEFAULT '0',
  `name` varchar(50) COLLATE utf8mb4_unicode_ci NOT NULL,
  `route_name` varchar(50) COLLATE utf8mb4_unicode_ci NOT NULL,
  `icon` varchar(255) COLLATE utf8mb4_unicode_ci NOT NULL DEFAULT 'fa fa-list',
  `status` enum('1','0') COLLATE utf8mb4_unicode_ci NOT NULL DEFAULT '1',
  `sort_order` decimal(5,2) NOT NULL DEFAULT '0.00',
  `created_at` timestamp NULL DEFAULT NULL,
  `updated_at` timestamp NULL DEFAULT NULL,
  `deleted_at` timestamp NULL DEFAULT NULL
) ENGINE=InnoDB DEFAULT CHARSET=utf8mb4 COLLATE=utf8mb4_unicode_ci;

--
-- Dumping data for table `cms_modules`
--

INSERT INTO `cms_modules` (`id`, `parent_id`, `name`, `route_name`, `icon`, `status`, `sort_order`, `created_at`, `updated_at`, `deleted_at`) VALUES
(1, 0, 'Cms Roles Management', 'cms-roles-management.index', 'fa fa-key', '1', 1.00, '2021-11-23 12:47:44', NULL, NULL),
(2, 0, 'Cms Users Management', 'cms-users-management.index', 'fa fa-users', '1', 2.00, '2021-11-23 12:47:44', NULL, NULL),
(3, 0, 'Application Setting', 'admin.application-setting', 'fa fa-cog', '1', 3.00, '2021-11-23 12:47:44', NULL, NULL),
(4, 0, 'Users Management', 'app-users.index', 'fa fa-users', '1', 4.00, '2021-11-23 12:47:44', NULL, NULL),
(5, 0, 'Content Management', 'content-management.index', 'fa fa-tasks', '1', 5.00, '2021-11-23 12:47:44', NULL, NULL),
(6, 0, 'FAQ`s', 'faq.index', 'fa fa-question-circle-o', '1', 6.00, '2021-11-23 12:47:44', NULL, NULL);

-- --------------------------------------------------------

--
-- Table structure for table `cms_module_permissions`
--

CREATE TABLE `cms_module_permissions` (
  `id` bigint(20) UNSIGNED NOT NULL,
  `cms_role_id` bigint(20) UNSIGNED NOT NULL,
  `cms_module_id` bigint(20) UNSIGNED NOT NULL,
  `is_add` enum('1','0') COLLATE utf8mb4_unicode_ci NOT NULL DEFAULT '0',
  `is_view` enum('1','0') COLLATE utf8mb4_unicode_ci NOT NULL DEFAULT '0',
  `is_update` enum('1','0') COLLATE utf8mb4_unicode_ci NOT NULL DEFAULT '0',
  `is_delete` enum('1','0') COLLATE utf8mb4_unicode_ci NOT NULL DEFAULT '0',
  `created_at` timestamp NULL DEFAULT NULL,
  `updated_at` timestamp NULL DEFAULT NULL,
  `deleted_at` timestamp NULL DEFAULT NULL
) ENGINE=InnoDB DEFAULT CHARSET=utf8mb4 COLLATE=utf8mb4_unicode_ci;

--
-- Dumping data for table `cms_module_permissions`
--

INSERT INTO `cms_module_permissions` (`id`, `cms_role_id`, `cms_module_id`, `is_add`, `is_view`, `is_update`, `is_delete`, `created_at`, `updated_at`, `deleted_at`) VALUES
(1, 2, 1, '0', '0', '0', '0', '2022-01-11 06:01:05', NULL, NULL),
(2, 2, 2, '0', '0', '0', '0', '2022-01-11 06:01:05', NULL, NULL),
(3, 2, 3, '0', '0', '0', '0', '2022-01-11 06:01:05', NULL, NULL),
(4, 2, 4, '0', '1', '1', '1', '2022-01-11 06:01:05', NULL, NULL),
(5, 2, 5, '1', '1', '1', '1', '2022-01-11 06:01:05', NULL, NULL),
(6, 2, 6, '0', '0', '0', '0', '2022-01-11 06:01:05', NULL, NULL);

-- --------------------------------------------------------

--
-- Table structure for table `cms_roles`
--

CREATE TABLE `cms_roles` (
  `id` bigint(20) UNSIGNED NOT NULL,
  `name` varchar(50) COLLATE utf8mb4_unicode_ci NOT NULL,
  `slug` varchar(50) COLLATE utf8mb4_unicode_ci NOT NULL,
  `is_super_admin` enum('1','0') COLLATE utf8mb4_unicode_ci NOT NULL DEFAULT '0',
  `created_at` timestamp NULL DEFAULT NULL,
  `updated_at` timestamp NULL DEFAULT NULL,
  `deleted_at` timestamp NULL DEFAULT NULL
) ENGINE=InnoDB DEFAULT CHARSET=utf8mb4 COLLATE=utf8mb4_unicode_ci;

--
-- Dumping data for table `cms_roles`
--

INSERT INTO `cms_roles` (`id`, `name`, `slug`, `is_super_admin`, `created_at`, `updated_at`, `deleted_at`) VALUES
(1, 'Super Admin', 'super-admin', '1', '2021-11-23 12:47:44', NULL, NULL),
(2, 'ShotShifter', 'shotshifter', '0', '2022-01-11 06:01:05', '2022-01-11 06:01:05', NULL);

-- --------------------------------------------------------

--
-- Table structure for table `cms_users`
--

CREATE TABLE `cms_users` (
  `id` bigint(20) UNSIGNED NOT NULL,
  `cms_role_id` bigint(20) UNSIGNED NOT NULL,
  `user_ref_id` int(11) NOT NULL DEFAULT '0',
  `name` varchar(50) COLLATE utf8mb4_unicode_ci NOT NULL,
  `username` varchar(50) COLLATE utf8mb4_unicode_ci NOT NULL,
  `slug` varchar(50) COLLATE utf8mb4_unicode_ci NOT NULL,
  `email` varchar(50) COLLATE utf8mb4_unicode_ci NOT NULL,
  `mobile_no` varchar(50) COLLATE utf8mb4_unicode_ci DEFAULT NULL,
  `password` varchar(255) COLLATE utf8mb4_unicode_ci NOT NULL,
  `image_url` text COLLATE utf8mb4_unicode_ci,
  `status` enum('1','0') COLLATE utf8mb4_unicode_ci NOT NULL DEFAULT '1',
  `remember_token` varchar(100) COLLATE utf8mb4_unicode_ci DEFAULT NULL,
  `created_at` timestamp NULL DEFAULT NULL,
  `updated_at` timestamp NULL DEFAULT NULL,
  `deleted_at` timestamp NULL DEFAULT NULL
) ENGINE=InnoDB DEFAULT CHARSET=utf8mb4 COLLATE=utf8mb4_unicode_ci;

--
-- Dumping data for table `cms_users`
--

INSERT INTO `cms_users` (`id`, `cms_role_id`, `user_ref_id`, `name`, `username`, `slug`, `email`, `mobile_no`, `password`, `image_url`, `status`, `remember_token`, `created_at`, `updated_at`, `deleted_at`) VALUES
(1, 1, 0, 'RetroCube', 'retrocube', 'retrocube', 'admin@retrocube.com', '1-8882051816', '$2y$10$.t/gWtdgcplQ3yQTFxz60egYXXcsIspFv3uhiPrVmbfWvQAn6md0y', NULL, '1', NULL, '2021-11-23 12:47:44', NULL, NULL),
(2, 2, 0, 'shotshifter', 'shotshifter', 'shotshifter', 'admin@shotshifter.com', '1-1112223210', '$2y$10$QDSvAPQzgIwi3z4ikrZ85O.lwzUAzHKsPK3yq/bl3JPptweIO5P4G', '/storage/cms_users/lUwGchgMgeCgjLjpsarctX58FWFiyskvDIvoJwk0.png', '1', NULL, '2022-01-11 06:02:29', '2022-01-11 06:02:29', NULL);

-- --------------------------------------------------------

--
-- Table structure for table `cms_widgets`
--

CREATE TABLE `cms_widgets` (
  `id` bigint(20) UNSIGNED NOT NULL,
  `title` varchar(200) COLLATE utf8mb4_unicode_ci NOT NULL,
  `description` varchar(255) COLLATE utf8mb4_unicode_ci DEFAULT NULL,
  `icon` varchar(200) COLLATE utf8mb4_unicode_ci NOT NULL,
  `color` varchar(200) COLLATE utf8mb4_unicode_ci NOT NULL,
  `div_column_class` varchar(200) COLLATE utf8mb4_unicode_ci NOT NULL,
  `link` text COLLATE utf8mb4_unicode_ci NOT NULL,
  `widget_type` enum('small_box','line_chart','bar_chat','pie_chart','map_chart') COLLATE utf8mb4_unicode_ci NOT NULL,
  `sql` text COLLATE utf8mb4_unicode_ci NOT NULL,
  `config` text COLLATE utf8mb4_unicode_ci NOT NULL,
  `status` enum('1','0') COLLATE utf8mb4_unicode_ci NOT NULL DEFAULT '0',
  `created_at` timestamp NULL DEFAULT NULL,
  `updated_at` timestamp NULL DEFAULT NULL,
  `deleted_at` timestamp NULL DEFAULT NULL
) ENGINE=InnoDB DEFAULT CHARSET=utf8mb4 COLLATE=utf8mb4_unicode_ci;

--
-- Dumping data for table `cms_widgets`
--

INSERT INTO `cms_widgets` (`id`, `title`, `description`, `icon`, `color`, `div_column_class`, `link`, `widget_type`, `sql`, `config`, `status`, `created_at`, `updated_at`, `deleted_at`) VALUES
(1, 'Total User', NULL, 'icon-user', '#4b71fa', 'col-md-3', '#', 'small_box', 'Select count(*) from users where deleted_at is null limit 1', '', '1', NULL, NULL, NULL),
(2, 'Total Shotlist', NULL, 'fa fa-camera-retro', '#7bcb4d', 'col-md-3', '#', 'small_box', 'Select count(*) from shot_list where deleted_at is null limit 1', '', '1', NULL, NULL, NULL),
(3, 'Total Scene', NULL, 'fa fa-video-camera', '#4b71fa', 'col-md-3', '#', 'small_box', 'Select count(*) from scenes where deleted_at is null limit 1', '', '1', NULL, NULL, NULL),
(4, 'Total Break', NULL, 'fa fa-tasks', '#7bcb4d ', 'col-md-3', '#', 'small_box', 'Select count(*) from breaks where deleted_at is null limit 1', '', '1', NULL, NULL, NULL),
(5, 'Users', NULL, 'icon-user', '#fff', 'col-md-12', '/admin/app-users', 'line_chart', 'SELECT count(id) AS value, MONTHNAME(created_at) as label FROM users group by MONTH(created_at) order by MONTH(created_at) asc', '', '1', NULL, NULL, NULL);

-- --------------------------------------------------------

--
-- Table structure for table `cms_widget_role`
--

CREATE TABLE `cms_widget_role` (
  `id` bigint(20) UNSIGNED NOT NULL,
  `cms_widget_id` bigint(20) UNSIGNED NOT NULL,
  `cms_role_id` bigint(20) UNSIGNED NOT NULL,
  `created_at` timestamp NULL DEFAULT NULL,
  `updated_at` timestamp NULL DEFAULT NULL,
  `deleted_at` timestamp NULL DEFAULT NULL
) ENGINE=InnoDB DEFAULT CHARSET=utf8mb4 COLLATE=utf8mb4_unicode_ci;

--
-- Dumping data for table `cms_widget_role`
--

INSERT INTO `cms_widget_role` (`id`, `cms_widget_id`, `cms_role_id`, `created_at`, `updated_at`, `deleted_at`) VALUES
(1, 1, 2, NULL, NULL, NULL),
(2, 2, 2, NULL, NULL, NULL),
(3, 3, 2, NULL, NULL, NULL),
(4, 4, 2, NULL, NULL, NULL),
(5, 5, 2, NULL, NULL, NULL);

-- --------------------------------------------------------

--
-- Table structure for table `content_management`
--

CREATE TABLE `content_management` (
  `id` bigint(20) UNSIGNED NOT NULL,
  `title` varchar(255) COLLATE utf8mb4_unicode_ci NOT NULL,
  `slug` varchar(45) COLLATE utf8mb4_unicode_ci NOT NULL,
  `content` text COLLATE utf8mb4_unicode_ci NOT NULL,
  `status` int(11) NOT NULL DEFAULT '1',
  `created_at` datetime NOT NULL DEFAULT CURRENT_TIMESTAMP,
  `updated_at` datetime DEFAULT NULL,
  `deleted_at` timestamp NULL DEFAULT NULL
) ENGINE=InnoDB DEFAULT CHARSET=utf8mb4 COLLATE=utf8mb4_unicode_ci;

--
-- Dumping data for table `content_management`
--

INSERT INTO `content_management` (`id`, `title`, `slug`, `content`, `status`, `created_at`, `updated_at`, `deleted_at`) VALUES
(1, 'Terms Condition', 'terms-condition', 'Lorem ipsum, or lipsum as it is sometimes known, is dummy text used in laying out print, graphic or web designs. The passage is attributed to an unknown typesetter in the 15th century who is thought to have scrambled parts of Cicero\'s De Finibus Bonorum et Malorum for use in a type specimen book.', 1, '2020-02-11 15:01:25', NULL, NULL),
(2, 'Privacy Policy', 'privacy-policy', 'Lorem ipsum, or lipsum as it is sometimes known, is dummy text used in laying out print, graphic or web designs. The passage is attributed to an unknown typesetter in the 15th century who is thought to have scrambled parts of Cicero\'s De Finibus Bonorum et Malorum for use in a type specimen book.', 1, '2020-02-11 15:01:25', NULL, NULL),
(3, 'About Us', 'about-us', 'Lorem ipsum, or lipsum as it is sometimes known, is dummy text used in laying out print, graphic or web designs. The passage is attributed to an unknown typesetter in the 15th century who is thought to have scrambled parts of Cicero\'s De Finibus Bonorum et Malorum for use in a type specimen book.', 1, '2020-02-11 15:01:25', NULL, NULL),
(4, 'About Us', 'help', 'Lorem ipsum, or lipsum as it is sometimes known, is dummy text used in laying out print, graphic or web designs. The passage is attributed to an unknown typesetter in the 15th century who is thought to have scrambled parts of Cicero\'s De Finibus Bonorum et Malorum for use in a type specimen book.', 1, '2020-02-11 15:01:25', '2022-01-11 06:06:45', NULL);

-- --------------------------------------------------------

--
-- Table structure for table `failed_jobs`
--

CREATE TABLE `failed_jobs` (
  `id` bigint(20) UNSIGNED NOT NULL,
  `uuid` varchar(255) COLLATE utf8mb4_unicode_ci NOT NULL,
  `connection` text COLLATE utf8mb4_unicode_ci NOT NULL,
  `queue` text COLLATE utf8mb4_unicode_ci NOT NULL,
  `payload` longtext COLLATE utf8mb4_unicode_ci NOT NULL,
  `exception` longtext COLLATE utf8mb4_unicode_ci NOT NULL,
  `failed_at` timestamp NOT NULL DEFAULT CURRENT_TIMESTAMP
) ENGINE=InnoDB DEFAULT CHARSET=utf8mb4 COLLATE=utf8mb4_unicode_ci;

-- --------------------------------------------------------

--
-- Table structure for table `faqs`
--

CREATE TABLE `faqs` (
  `id` bigint(20) UNSIGNED NOT NULL,
  `slug` varchar(255) COLLATE utf8mb4_unicode_ci NOT NULL,
  `question` text COLLATE utf8mb4_unicode_ci NOT NULL,
  `answer` text COLLATE utf8mb4_unicode_ci NOT NULL,
  `status` int(11) NOT NULL DEFAULT '1',
  `created_at` datetime NOT NULL DEFAULT CURRENT_TIMESTAMP,
  `updated_at` datetime DEFAULT NULL,
  `deleted_at` timestamp NULL DEFAULT NULL
) ENGINE=InnoDB DEFAULT CHARSET=utf8mb4 COLLATE=utf8mb4_unicode_ci;

--
-- Dumping data for table `faqs`
--

INSERT INTO `faqs` (`id`, `slug`, `question`, `answer`, `status`, `created_at`, `updated_at`, `deleted_at`) VALUES
(1, '619ce2f10c150619ce2f10c152', 'How to change the language', 'Lorem ipsum, or lipsum as it is sometimes known, is dummy text used in laying out print, graphic or web designs. The passage is attributed to an unknown typesetter in the 15th century who is thought to have scrambled parts of Cicero\'s De Finibus Bonorum et Malorum for use in a type specimen book.', 1, '2020-02-17 15:45:47', NULL, NULL),
(2, '619ce2f10c154619ce2f10c155', 'How to restore your chat history', 'Lorem ipsum, or lipsum as it is sometimes known, is dummy text used in laying out print, graphic or web designs. The passage is attributed to an unknown typesetter in the 15th century who is thought to have scrambled parts of Cicero\'s De Finibus Bonorum et Malorum for use in a type specimen book.', 1, '2020-02-17 15:51:16', NULL, NULL);

-- --------------------------------------------------------

--
-- Table structure for table `jobs`
--

CREATE TABLE `jobs` (
  `id` bigint(20) UNSIGNED NOT NULL,
  `queue` varchar(255) COLLATE utf8mb4_unicode_ci NOT NULL,
  `payload` longtext COLLATE utf8mb4_unicode_ci NOT NULL,
  `attempts` tinyint(3) UNSIGNED NOT NULL,
  `reserved_at` int(10) UNSIGNED DEFAULT NULL,
  `available_at` int(10) UNSIGNED NOT NULL,
  `created_at` int(10) UNSIGNED NOT NULL
) ENGINE=InnoDB DEFAULT CHARSET=utf8mb4 COLLATE=utf8mb4_unicode_ci;

-- --------------------------------------------------------

--
-- Table structure for table `mail_templates`
--

CREATE TABLE `mail_templates` (
  `id` bigint(20) UNSIGNED NOT NULL,
  `identifier` varchar(100) COLLATE utf8mb4_unicode_ci NOT NULL,
  `subject` varchar(255) COLLATE utf8mb4_unicode_ci NOT NULL,
  `body` text COLLATE utf8mb4_unicode_ci NOT NULL,
  `wildcard` text COLLATE utf8mb4_unicode_ci NOT NULL,
  `created_at` timestamp NULL DEFAULT NULL,
  `updated_at` timestamp NULL DEFAULT NULL,
  `deleted_at` timestamp NULL DEFAULT NULL
) ENGINE=InnoDB DEFAULT CHARSET=utf8mb4 COLLATE=utf8mb4_unicode_ci;

--
-- Dumping data for table `mail_templates`
--

INSERT INTO `mail_templates` (`id`, `identifier`, `subject`, `body`, `wildcard`, `created_at`, `updated_at`, `deleted_at`) VALUES
(1, 'forgot-password', 'Forgot Password Confirmation', '<table class=\"main\" style=\"border-collapse: separate; mso-table-lspace: 0pt; mso-table-rspace: 0pt; width: 100%; background: #ffffff; border-radius: 3px;\">\r\n    <tr>\r\n        <td class=\"wrapper\" style=\"font-family: sans-serif; font-size: 14px; vertical-align: top; box-sizing: border-box; padding: 20px;\">\r\n            <table border=\"0\" cellpadding=\"0\" cellspacing=\"0\" style=\"border-collapse: separate; mso-table-lspace: 0pt; mso-table-rspace: 0pt; width: 100%;\">\r\n                <tr>\r\n                    <td style=\"font-family: sans-serif; font-size: 14px; vertical-align: top;\">\r\n                        <p style=\"font-family: sans-serif; font-size: 14px; font-weight: normal; margin: 0; Margin-bottom: 15px;\">Hi [USERNAME],</p>\r\n                        <p style=\"font-family: sans-serif; font-size: 14px; font-weight: normal; margin: 0; Margin-bottom: 15px;\">A request has been made to recover password for your account. Please follow below link to generate new password for your account :</p>\r\n                        <p><a href=\"[LINK]\">Reset Password</a></p>\r\n                        <br>\r\n                        <br>\r\n                        <p style=\"font-family: sans-serif; font-size: 14px; font-weight: normal; margin: 0; Margin-bottom: 15px;\">Regards,</p>\r\n                        <p style=\"font-family: sans-serif; font-size: 14px; font-weight: normal; margin: 0; Margin-bottom: 15px;\"> [YEAR] [APP_NAME] All Rights reserved.</p>\r\n                    </td>\r\n                </tr>\r\n            </table>\r\n        </td>\r\n    </tr>\r\n</table>\r\n', '[USERNAME],[LINK],[YEAR],[APP_NAME]', '2021-11-23 12:47:44', NULL, NULL),
(2, 'user_registration', 'Welcome to [APP_NAME]', '<table class=\"main\" style=\"border-collapse: separate; mso-table-lspace: 0pt; mso-table-rspace: 0pt; width: 100%; background: #ffffff; border-radius: 3px;\">\r\n    <tr>\r\n        <td class=\"wrapper\" style=\"font-family: sans-serif; font-size: 14px; vertical-align: top; box-sizing: border-box; padding: 20px;\">\r\n            <table border=\"0\" cellpadding=\"0\" cellspacing=\"0\" style=\"border-collapse: separate; mso-table-lspace: 0pt; mso-table-rspace: 0pt; width: 100%;\">\r\n                <tr>\r\n                    <td style=\"font-family: sans-serif; font-size: 14px; vertical-align: top;\">\r\n                        <p style=\"font-family: sans-serif; font-size: 14px; font-weight: normal; margin: 0; Margin-bottom: 15px;\">Hi [USERNAME],</p>\r\n                        <p style=\"font-family: sans-serif; font-size: 14px; font-weight: normal; margin: 0; Margin-bottom: 15px;\">Your account has been created successfully. First, you need to confirm your account. Just click the below link</p>\r\n                        <p><a href=\"[LINK]\">Verify Now</a></p>\r\n                        <br>\r\n                        <br>\r\n                        <p style=\"font-family: sans-serif; font-size: 14px; font-weight: normal; margin: 0; Margin-bottom: 15px;\">Regards,</p>\r\n                        <p style=\"font-family: sans-serif; font-size: 14px; font-weight: normal; margin: 0; Margin-bottom: 15px;\"> [YEAR] [APP_NAME] All Rights reserved.</p>\r\n                    </td>\r\n                </tr>\r\n            </table>\r\n        </td>\r\n    </tr>\r\n</table>\r\n', '[USERNAME],[LINK],[YEAR],[APP_NAME]', '2021-11-23 12:47:44', NULL, NULL);

-- --------------------------------------------------------

--
-- Table structure for table `media`
--

CREATE TABLE `media` (
  `id` bigint(20) UNSIGNED NOT NULL,
  `module` varchar(100) COLLATE utf8mb4_unicode_ci NOT NULL,
  `module_id` int(11) NOT NULL,
  `filename` varchar(200) COLLATE utf8mb4_unicode_ci NOT NULL,
  `original_name` varchar(200) COLLATE utf8mb4_unicode_ci NOT NULL,
  `file_url` text COLLATE utf8mb4_unicode_ci NOT NULL,
  `thumbnail_url` text COLLATE utf8mb4_unicode_ci,
  `mime_type` varchar(50) COLLATE utf8mb4_unicode_ci NOT NULL,
  `file_type` varchar(50) COLLATE utf8mb4_unicode_ci NOT NULL,
  `driver` varchar(50) COLLATE utf8mb4_unicode_ci NOT NULL DEFAULT 'local',
  `media_type` enum('public','private') COLLATE utf8mb4_unicode_ci NOT NULL DEFAULT 'public',
  `meta` text COLLATE utf8mb4_unicode_ci,
  `created_at` timestamp NULL DEFAULT NULL,
  `updated_at` timestamp NULL DEFAULT NULL,
  `deleted_at` timestamp NULL DEFAULT NULL
) ENGINE=InnoDB DEFAULT CHARSET=utf8mb4 COLLATE=utf8mb4_unicode_ci;

-- --------------------------------------------------------

--
-- Table structure for table `migrations`
--

CREATE TABLE `migrations` (
  `id` int(10) UNSIGNED NOT NULL,
  `migration` varchar(255) COLLATE utf8mb4_unicode_ci NOT NULL,
  `batch` int(11) NOT NULL
) ENGINE=InnoDB DEFAULT CHARSET=utf8mb4 COLLATE=utf8mb4_unicode_ci;

--
-- Dumping data for table `migrations`
--

INSERT INTO `migrations` (`id`, `migration`, `batch`) VALUES
(1, '2019_08_19_000000_create_failed_jobs_table', 1),
(2, '2021_03_05_000000_create_cms_roles_table', 1),
(3, '2021_03_05_172240_create_cms_users_table', 1),
(4, '2021_03_05_174918_create_cms_modules_table', 1),
(5, '2021_03_05_175415_create_cms_module_permissions_table', 1),
(6, '2021_03_06_185651_create_mail_templates_table', 1),
(7, '2021_03_08_191839_create_reset_password_table', 1),
(8, '2021_03_13_121206_create_application_setting_table', 1),
(9, '2021_04_20_200223_create_user_groups_table', 1),
(10, '2021_04_20_200451_create_users_table', 1),
(11, '2021_04_20_202053_create_user_api_token_table', 1),
(12, '2021_06_04_181436_create_notification_table', 1),
(13, '2021_06_06_130550_create_notification_setting_table', 1),
(14, '2021_08_29_105840_create_jobs_table', 1),
(15, '2021_09_07_154417_create_cms_widgets_table', 1),
(16, '2021_09_07_161059_create_cms_widget_role_table', 1),
(17, '2021_09_08_081135_create_content_management_table', 1),
(18, '2021_09_08_082346_create_faqs_table', 1),
(19, '2021_09_20_180624_create_media_table', 1),
(20, '2021_10_05_172625_user_follow', 1),
(21, '2021_10_12_155219_post', 1),
(22, '2021_10_12_161817_post_tagged_user', 1),
(23, '2021_10_12_162512_post_media', 1),
(24, '2021_10_12_163704_post_like', 1),
(25, '2021_10_12_164023_reactions', 1),
(26, '2021_10_12_164452_post_comments', 1),
(27, '2021_10_12_164953_post_share', 1),
(28, '2021_10_12_165719_post_report', 1),
(29, '2021_10_13_165453_feeling_activity', 1),
(30, '2021_11_24_081654_create_shot_list_table', 2),
(31, '2021_11_24_081858_create_scenes_table', 2),
(32, '2021_11_24_081933_create_breaks_table', 2),
(33, '2021_11_24_081958_create_user_share_table', 2),
(34, '2021_11_24_082347_create_user_member_table', 2);

-- --------------------------------------------------------

--
-- Table structure for table `notification`
--

CREATE TABLE `notification` (
  `id` bigint(20) UNSIGNED NOT NULL,
  `unique_id` varchar(255) COLLATE utf8mb4_unicode_ci NOT NULL,
  `identifier` varchar(255) COLLATE utf8mb4_unicode_ci NOT NULL,
  `actor_id` int(11) NOT NULL,
  `actor_type` enum('users','cms_users') COLLATE utf8mb4_unicode_ci NOT NULL DEFAULT 'users',
  `target_id` int(11) NOT NULL,
  `target_type` enum('users','cms_users') COLLATE utf8mb4_unicode_ci NOT NULL DEFAULT 'users',
  `reference_id` int(11) NOT NULL,
  `reference_module` varchar(255) COLLATE utf8mb4_unicode_ci NOT NULL,
  `title` varchar(255) COLLATE utf8mb4_unicode_ci NOT NULL,
  `description` text COLLATE utf8mb4_unicode_ci NOT NULL,
  `web_redirect_link` text COLLATE utf8mb4_unicode_ci,
  `is_read` enum('0','1') COLLATE utf8mb4_unicode_ci NOT NULL DEFAULT '0',
  `is_view` enum('0','1') COLLATE utf8mb4_unicode_ci NOT NULL DEFAULT '0',
  `created_at` timestamp NULL DEFAULT NULL,
  `updated_at` timestamp NULL DEFAULT NULL
) ENGINE=InnoDB DEFAULT CHARSET=utf8mb4 COLLATE=utf8mb4_unicode_ci;

--
-- Dumping data for table `notification`
--

INSERT INTO `notification` (`id`, `unique_id`, `identifier`, `actor_id`, `actor_type`, `target_id`, `target_type`, `reference_id`, `reference_module`, `title`, `description`, `web_redirect_link`, `is_read`, `is_view`, `created_at`, `updated_at`) VALUES
(1, '62c3f37d6149c', 'add_member', 45, 'users', 27, 'users', 274, 'shot_list', 'Shot Shifter', 'Helen added you in Shot list Nnnn', NULL, '0', '0', '2022-07-05 12:17:01', NULL),
(2, '62c3f37d6149c', 'add_member', 45, 'users', 48, 'users', 274, 'shot_list', 'Shot Shifter', 'Helen added you in Shot list Nnnn', NULL, '0', '0', '2022-07-05 12:17:01', NULL),
(3, '62c3f40430ccf', 'add_member', 45, 'users', 2, 'users', 3, 'shot_list', 'Shot Shifter', 'Helen added you in Shot list Dsds', NULL, '0', '0', '2022-07-05 12:19:16', NULL),
(4, '62c3f40430ccf', 'add_member', 45, 'users', 3, 'users', 3, 'shot_list', 'Shot Shifter', 'Helen added you in Shot list Dsds', NULL, '0', '0', '2022-07-05 12:19:16', NULL),
(5, '62c3f44c5929f', 'add_member', 45, 'users', 2, 'users', 3, 'shot_list', 'Shot Shifter', 'Helen added you in Shot list Dsds', NULL, '0', '0', '2022-07-05 12:20:28', NULL),
(6, '62c3f44c5929f', 'add_member', 45, 'users', 3, 'users', 3, 'shot_list', 'Shot Shifter', 'Helen added you in Shot list Dsds', NULL, '0', '0', '2022-07-05 12:20:28', NULL),
(7, '62c3f89f92136', 'add_member', 45, 'users', 11, 'users', 274, 'shot_list', 'Shot Shifter', 'Helen added you in Shot list Nnnn', NULL, '0', '0', '2022-07-05 12:38:55', NULL),
(8, '62c411e8c7e4a', 'add_member', 45, 'users', 15, 'users', 274, 'shot_list', 'Shot Shifter', 'Helen added you in Shot list Nnnn', NULL, '0', '0', '2022-07-05 14:26:48', NULL),
(9, '62c411e8c7e4a', 'add_member', 45, 'users', 18, 'users', 274, 'shot_list', 'Shot Shifter', 'Helen added you in Shot list Nnnn', NULL, '0', '0', '2022-07-05 14:26:48', NULL),
(10, '62da7f1406451', 'add_member', 54, 'users', 47, 'users', 320, 'shot_list', 'Shot Shifter', 'Test added you in Shot list Ft', NULL, '0', '0', '2022-07-22 14:42:28', NULL),
(11, '62da81239c678', 'add_member', 54, 'users', 11, 'users', 320, 'shot_list', 'Shot Shifter', 'Test added you in Shot list Ft', NULL, '0', '0', '2022-07-22 14:51:15', NULL),
(12, '62da81239c678', 'add_member', 54, 'users', 14, 'users', 320, 'shot_list', 'Shot Shifter', 'Test added you in Shot list Ft', NULL, '0', '0', '2022-07-22 14:51:15', NULL),
(13, '62da8142eecce', 'add_member', 54, 'users', 47, 'users', 320, 'shot_list', 'Shot Shifter', 'Test added you in Shot list Ft', NULL, '0', '0', '2022-07-22 14:51:47', NULL),
(14, '62da850688e62', 'add_member', 54, 'users', 48, 'users', 321, 'shot_list', 'Shot Shifter', 'Test added you in Shot list Hhh', NULL, '0', '0', '2022-07-22 15:07:50', NULL),
(15, '62de8c1c19099', 'add_member', 55, 'users', 56, 'users', 327, 'shot_list', 'Shot Shifter', 'lucifer added you in Shot list List 1', NULL, '0', '0', '2022-07-25 16:27:08', NULL),
(16, '62de8c2da8321', 'remove_member', 55, 'users', 56, 'users', 327, 'shot_list', 'Shot Shifter', 'lucifer removed you in Shot list List 1', NULL, '0', '0', '2022-07-25 16:27:25', NULL),
(17, '62de8c5a993be', 'add_member', 55, 'users', 56, 'users', 327, 'shot_list', 'Shot Shifter', 'lucifer added you in Shot list List 1', NULL, '0', '0', '2022-07-25 16:28:10', NULL),
(18, '62dfe0fd87325', 'add_member', 56, 'users', 35, 'users', 329, 'shot_list', 'Shot Shifter', 'lucifer added you in Shot list Aaa', NULL, '0', '0', '2022-07-26 16:41:33', NULL),
(19, '62dfe11023ae4', 'remove_member', 56, 'users', 35, 'users', 329, 'shot_list', 'Shot Shifter', 'lucifer removed you in Shot list Aaa', NULL, '0', '0', '2022-07-26 16:41:52', NULL),
(20, '62dfe152eb680', 'add_member', 56, 'users', 35, 'users', 329, 'shot_list', 'Shot Shifter', 'lucifer added you in Shot list Aaa', NULL, '0', '0', '2022-07-26 16:42:59', NULL),
(21, '62e0f3066bbac', 'add_member', 57, 'users', 11, 'users', 334, 'shot_list', 'Shot Shifter', 'Browniee added you in Shot list Dsf', NULL, '0', '0', '2022-07-27 12:10:46', NULL),
(22, '62e0f3066bbac', 'add_member', 57, 'users', 14, 'users', 334, 'shot_list', 'Shot Shifter', 'Browniee added you in Shot list Dsf', NULL, '0', '0', '2022-07-27 12:10:46', NULL),
(23, '62e0f3066bbac', 'add_member', 57, 'users', 15, 'users', 334, 'shot_list', 'Shot Shifter', 'Browniee added you in Shot list Dsf', NULL, '0', '0', '2022-07-27 12:10:46', NULL),
(24, '62e11736ab8df', 'add_member', 57, 'users', 27, 'users', 337, 'shot_list', 'Shot Shifter', 'Browniee added you in Shot list Fs', NULL, '0', '0', '2022-07-27 14:45:10', NULL),
(25, '62e11736ab8df', 'add_member', 57, 'users', 48, 'users', 337, 'shot_list', 'Shot Shifter', 'Browniee added you in Shot list Fs', NULL, '0', '0', '2022-07-27 14:45:10', NULL),
(26, '62e16fc639b2a', 'add_member', 57, 'users', 11, 'users', 337, 'shot_list', 'Shot Shifter', 'Browniee added you in Shot list Fs', NULL, '0', '0', '2022-07-27 21:03:02', NULL),
(27, '62e16fc639b2a', 'add_member', 57, 'users', 14, 'users', 337, 'shot_list', 'Shot Shifter', 'Browniee added you in Shot list Fs', NULL, '0', '0', '2022-07-27 21:03:02', NULL),
(28, '62e16feb2282d', 'add_member', 57, 'users', 15, 'users', 337, 'shot_list', 'Shot Shifter', 'Browniee added you in Shot list Fs', NULL, '0', '0', '2022-07-27 21:03:39', NULL),
(29, '62e17038d07a8', 'add_member', 57, 'users', 18, 'users', 337, 'shot_list', 'Shot Shifter', 'Browniee added you in Shot list Fs', NULL, '0', '0', '2022-07-27 21:04:56', NULL),
(30, '62e1706592a19', 'add_member', 57, 'users', 20, 'users', 337, 'shot_list', 'Shot Shifter', 'Browniee added you in Shot list Fs', NULL, '0', '0', '2022-07-27 21:05:41', NULL),
(31, '62e1706592a19', 'add_member', 57, 'users', 22, 'users', 337, 'shot_list', 'Shot Shifter', 'Browniee added you in Shot list Fs', NULL, '0', '0', '2022-07-27 21:05:41', NULL),
(32, '62e17251e1ab5', 'add_member', 57, 'users', 24, 'users', 337, 'shot_list', 'Shot Shifter', 'Browniee added you in Shot list Fs', NULL, '0', '0', '2022-07-27 21:13:53', NULL),
(33, '62e17278b9837', 'remove_member', 57, 'users', 48, 'users', 337, 'shot_list', 'Shot Shifter', 'Browniee removed you in Shot list Fs', NULL, '0', '0', '2022-07-27 21:14:32', NULL),
(34, '62e1727c311aa', 'remove_member', 57, 'users', 27, 'users', 337, 'shot_list', 'Shot Shifter', 'Browniee removed you in Shot list Fs', NULL, '0', '0', '2022-07-27 21:14:36', NULL),
(35, '62e17281c83ac', 'remove_member', 57, 'users', 14, 'users', 337, 'shot_list', 'Shot Shifter', 'Browniee removed you in Shot list Fs', NULL, '0', '0', '2022-07-27 21:14:41', NULL),
(36, '62e17286e362c', 'remove_member', 57, 'users', 11, 'users', 337, 'shot_list', 'Shot Shifter', 'Browniee removed you in Shot list Fs', NULL, '0', '0', '2022-07-27 21:14:46', NULL),
(37, '62e1728b6fd8f', 'remove_member', 57, 'users', 15, 'users', 337, 'shot_list', 'Shot Shifter', 'Browniee removed you in Shot list Fs', NULL, '0', '0', '2022-07-27 21:14:51', NULL),
(38, '62e172919ec2a', 'remove_member', 57, 'users', 18, 'users', 337, 'shot_list', 'Shot Shifter', 'Browniee removed you in Shot list Fs', NULL, '0', '0', '2022-07-27 21:14:57', NULL),
(39, '62e1729957ab5', 'remove_member', 57, 'users', 20, 'users', 337, 'shot_list', 'Shot Shifter', 'Browniee removed you in Shot list Fs', NULL, '0', '0', '2022-07-27 21:15:05', NULL),
(40, '62e1729ccdaa4', 'remove_member', 57, 'users', 24, 'users', 337, 'shot_list', 'Shot Shifter', 'Browniee removed you in Shot list Fs', NULL, '0', '0', '2022-07-27 21:15:08', NULL),
(41, '62e1729f909d4', 'remove_member', 57, 'users', 22, 'users', 337, 'shot_list', 'Shot Shifter', 'Browniee removed you in Shot list Fs', NULL, '0', '0', '2022-07-27 21:15:12', NULL),
(42, '62e172c9bbc8a', 'add_member', 57, 'users', 48, 'users', 337, 'shot_list', 'Shot Shifter', 'Browniee added you in Shot list Fs', NULL, '0', '0', '2022-07-27 21:15:53', NULL),
(43, '62e218bdcc9d0', 'add_member', 57, 'users', 11, 'users', 337, 'shot_list', 'Shot Shifter', 'Browniee added you in Shot list Fs', NULL, '0', '0', '2022-07-28 09:03:57', NULL),
(44, '62e218bdcc9d0', 'add_member', 57, 'users', 14, 'users', 337, 'shot_list', 'Shot Shifter', 'Browniee added you in Shot list Fs', NULL, '0', '0', '2022-07-28 09:03:57', NULL),
(45, '62e218cc1a1e2', 'add_member', 57, 'users', 15, 'users', 337, 'shot_list', 'Shot Shifter', 'Browniee added you in Shot list Fs', NULL, '0', '0', '2022-07-28 09:04:12', NULL),
(46, '62e226c2257dc', 'add_member', 54, 'users', 48, 'users', 323, 'shot_list', 'Shot Shifter', 'Test added you in Shot list Bbb', NULL, '0', '0', '2022-07-28 10:03:46', NULL),
(47, '62e233c4499f8', 'add_member', 48, 'users', 24, 'users', 341, 'shot_list', 'Shot Shifter', 'Leo added you in Shot list Testing ', NULL, '0', '0', '2022-07-28 10:59:16', NULL),
(48, '62e233c4499f8', 'add_member', 48, 'users', 27, 'users', 341, 'shot_list', 'Shot Shifter', 'Leo added you in Shot list Testing ', NULL, '0', '0', '2022-07-28 10:59:16', NULL),
(49, '62e233d44d789', 'add_member', 48, 'users', 22, 'users', 341, 'shot_list', 'Shot Shifter', 'Leo added you in Shot list Testing ', NULL, '0', '0', '2022-07-28 10:59:32', NULL),
(50, '62e234e660562', 'add_member', 48, 'users', 11, 'users', 341, 'shot_list', 'Shot Shifter', 'Leo added you in Shot list Testing ', NULL, '0', '0', '2022-07-28 11:04:06', NULL),
(51, '62e234e660562', 'add_member', 48, 'users', 14, 'users', 341, 'shot_list', 'Shot Shifter', 'Leo added you in Shot list Testing ', NULL, '0', '0', '2022-07-28 11:04:06', NULL),
(52, '62e23682d9889', 'add_member', 48, 'users', 15, 'users', 341, 'shot_list', 'Shot Shifter', 'Leo added you in Shot list Testing ', NULL, '0', '0', '2022-07-28 11:10:58', NULL),
(53, '62e23699e5051', 'add_member', 48, 'users', 18, 'users', 341, 'shot_list', 'Shot Shifter', 'Leo added you in Shot list Testing ', NULL, '0', '0', '2022-07-28 11:11:21', NULL),
(54, '62e236fb88f97', 'remove_member', 48, 'users', 14, 'users', 341, 'shot_list', 'Shot Shifter', 'Leo removed you in Shot list Testing ', NULL, '0', '0', '2022-07-28 11:12:59', NULL),
(55, '62e2370495ada', 'remove_member', 48, 'users', 11, 'users', 341, 'shot_list', 'Shot Shifter', 'Leo removed you in Shot list Testing ', NULL, '0', '0', '2022-07-28 11:13:08', NULL),
(56, '62e23706e16d1', 'remove_member', 48, 'users', 22, 'users', 341, 'shot_list', 'Shot Shifter', 'Leo removed you in Shot list Testing ', NULL, '0', '0', '2022-07-28 11:13:10', NULL),
(57, '62e2370ba0bc9', 'remove_member', 48, 'users', 15, 'users', 341, 'shot_list', 'Shot Shifter', 'Leo removed you in Shot list Testing ', NULL, '0', '0', '2022-07-28 11:13:15', NULL),
(58, '62e2370e5feeb', 'remove_member', 48, 'users', 18, 'users', 341, 'shot_list', 'Shot Shifter', 'Leo removed you in Shot list Testing ', NULL, '0', '0', '2022-07-28 11:13:18', NULL),
(59, '62e23892910a1', 'add_member', 48, 'users', 11, 'users', 341, 'shot_list', 'Shot Shifter', 'Leo added you in Shot list Testing ', NULL, '0', '0', '2022-07-28 11:19:46', NULL),
(60, '62e23892910a1', 'add_member', 48, 'users', 14, 'users', 341, 'shot_list', 'Shot Shifter', 'Leo added you in Shot list Testing ', NULL, '0', '0', '2022-07-28 11:19:46', NULL),
(61, '62e2392dadd40', 'add_member', 48, 'users', 15, 'users', 341, 'shot_list', 'Shot Shifter', 'Leo added you in Shot list Testing ', NULL, '0', '0', '2022-07-28 11:22:21', NULL),
(62, '62e2392dadd40', 'add_member', 48, 'users', 18, 'users', 341, 'shot_list', 'Shot Shifter', 'Leo added you in Shot list Testing ', NULL, '0', '0', '2022-07-28 11:22:21', NULL),
(63, '62e23ace69afb', 'add_member', 48, 'users', 11, 'users', 339, 'shot_list', 'Shot Shifter', 'Leo added you in Shot list Yy', NULL, '0', '0', '2022-07-28 11:29:18', NULL),
(64, '62e23d6b5c492', 'add_member', 48, 'users', 11, 'users', 343, 'shot_list', 'Shot Shifter', 'Leo added you in Shot list Xyzz', NULL, '0', '0', '2022-07-28 11:40:27', NULL),
(65, '62e23d77a145f', 'add_member', 48, 'users', 14, 'users', 343, 'shot_list', 'Shot Shifter', 'Leo added you in Shot list Xyzz', NULL, '0', '0', '2022-07-28 11:40:39', NULL),
(66, '62e23d77a145f', 'add_member', 48, 'users', 15, 'users', 343, 'shot_list', 'Shot Shifter', 'Leo added you in Shot list Xyzz', NULL, '0', '0', '2022-07-28 11:40:39', NULL),
(67, '62e23e53c24a8', 'add_member', 48, 'users', 14, 'users', 344, 'shot_list', 'Shot Shifter', 'Leo added you in Shot list Iop', NULL, '0', '0', '2022-07-28 11:44:19', NULL),
(68, '62e23ec80b0fe', 'add_member', 48, 'users', 11, 'users', 345, 'shot_list', 'Shot Shifter', 'Leo added you in Shot list Memberrrr issue', NULL, '0', '0', '2022-07-28 11:46:16', NULL),
(69, '62e24089a0d55', 'add_member', 48, 'users', 14, 'users', 345, 'shot_list', 'Shot Shifter', 'Leo added you in Shot list Memberrrr issue', NULL, '0', '0', '2022-07-28 11:53:45', NULL),
(70, '62e2497f96787', 'add_member', 48, 'users', 11, 'users', 348, 'shot_list', 'Shot Shifter', 'Leo added you in Shot list Uu', NULL, '0', '0', '2022-07-28 12:31:59', NULL),
(71, '62e2497f96787', 'add_member', 48, 'users', 14, 'users', 348, 'shot_list', 'Shot Shifter', 'Leo added you in Shot list Uu', NULL, '0', '0', '2022-07-28 12:31:59', NULL),
(72, '62e24996bdba8', 'add_member', 48, 'users', 15, 'users', 348, 'shot_list', 'Shot Shifter', 'Leo added you in Shot list Uu', NULL, '0', '0', '2022-07-28 12:32:22', NULL),
(73, '62e24996bdba8', 'add_member', 48, 'users', 18, 'users', 348, 'shot_list', 'Shot Shifter', 'Leo added you in Shot list Uu', NULL, '0', '0', '2022-07-28 12:32:22', NULL),
(74, '62e28bf8ec7b7', 'add_member', 29, 'users', 35, 'users', 376, 'shot_list', 'Shot Shifter', 'Sarah added you in Shot list Nnnn', NULL, '0', '0', '2022-07-28 17:15:37', NULL),
(75, '62e3be0c36647', 'add_member', 61, 'users', 62, 'users', 393, 'shot_list', 'Shot Shifter', 'Green added you in Shot list List 1', NULL, '0', '0', '2022-07-29 15:01:32', NULL),
(76, '62e3bea398973', 'remove_member', 61, 'users', 62, 'users', 393, 'shot_list', 'Shot Shifter', 'Green removed you in Shot list List 1', NULL, '0', '0', '2022-07-29 15:04:03', NULL),
(77, '62e3beac380f3', 'add_member', 61, 'users', 62, 'users', 393, 'shot_list', 'Shot Shifter', 'Green added you in Shot list List 1', NULL, '0', '0', '2022-07-29 15:04:12', NULL),
(78, '62e3c11be995e', 'remove_member', 61, 'users', 62, 'users', 393, 'shot_list', 'Shot Shifter', 'Green removed you in Shot list List 1', NULL, '0', '0', '2022-07-29 15:14:36', NULL),
(79, '62e3c12369ead', 'add_member', 61, 'users', 62, 'users', 393, 'shot_list', 'Shot Shifter', 'Green added you in Shot list List 1', NULL, '0', '0', '2022-07-29 15:14:43', NULL),
(80, '62e77b0c7b7f7', 'add_member', 48, 'users', 11, 'users', 427, 'shot_list', 'Shot Shifter', 'Leo added you in Shot list Vfvf', NULL, '0', '0', '2022-08-01 11:04:44', NULL),
(81, '62e77b0c7b7f7', 'add_member', 48, 'users', 14, 'users', 427, 'shot_list', 'Shot Shifter', 'Leo added you in Shot list Vfvf', NULL, '0', '0', '2022-08-01 11:04:44', NULL),
(82, '62e77b0c7b7f7', 'add_member', 48, 'users', 15, 'users', 427, 'shot_list', 'Shot Shifter', 'Leo added you in Shot list Vfvf', NULL, '0', '0', '2022-08-01 11:04:44', NULL),
(83, '62e77c2b70111', 'add_member', 48, 'users', 22, 'users', 427, 'shot_list', 'Shot Shifter', 'Leo added you in Shot list Vfvf', NULL, '0', '0', '2022-08-01 11:09:31', NULL),
(84, '62e78051bd82b', 'add_member', 48, 'users', 11, 'users', 431, 'shot_list', 'Shot Shifter', 'Leo added you in Shot list New shot', NULL, '0', '0', '2022-08-01 11:27:13', NULL),
(85, '62e78051bd82b', 'add_member', 48, 'users', 14, 'users', 431, 'shot_list', 'Shot Shifter', 'Leo added you in Shot list New shot', NULL, '0', '0', '2022-08-01 11:27:13', NULL),
(86, '62e78051bd82b', 'add_member', 48, 'users', 15, 'users', 431, 'shot_list', 'Shot Shifter', 'Leo added you in Shot list New shot', NULL, '0', '0', '2022-08-01 11:27:13', NULL),
(87, '62e7805e1f73c', 'add_member', 48, 'users', 18, 'users', 431, 'shot_list', 'Shot Shifter', 'Leo added you in Shot list New shot', NULL, '0', '0', '2022-08-01 11:27:26', NULL),
(88, '62e785d239464', 'add_member', 48, 'users', 14, 'users', 434, 'shot_list', 'Shot Shifter', 'Leo added you in Shot list Gdrhr', NULL, '0', '0', '2022-08-01 11:50:42', NULL),
(89, '62e785e2596e5', 'add_member', 48, 'users', 15, 'users', 434, 'shot_list', 'Shot Shifter', 'Leo added you in Shot list Gdrhr', NULL, '0', '0', '2022-08-01 11:50:58', NULL),
(90, '62e7a185e5439', 'add_member', 48, 'users', 11, 'users', 441, 'shot_list', 'Shot Shifter', 'Leo added you in Shot list Jnl', NULL, '0', '0', '2022-08-01 13:48:54', NULL),
(91, '62e7a185e5439', 'add_member', 48, 'users', 14, 'users', 441, 'shot_list', 'Shot Shifter', 'Leo added you in Shot list Jnl', NULL, '0', '0', '2022-08-01 13:48:54', NULL),
(92, '6345178d72712', 'add_member', 68, 'users', 11, 'users', 660, 'shot_list', 'Shot Shifter', 'Peter Aa added you in Shot list Hh', NULL, '0', '0', '2022-10-11 11:13:17', NULL);

-- --------------------------------------------------------

--
-- Table structure for table `notification_setting`
--

CREATE TABLE `notification_setting` (
  `id` bigint(20) UNSIGNED NOT NULL,
  `user_id` bigint(20) UNSIGNED NOT NULL,
  `meta_key` varchar(100) COLLATE utf8mb4_unicode_ci NOT NULL,
  `meta_value` int(11) NOT NULL,
  `created_at` timestamp NULL DEFAULT NULL,
  `updated_at` timestamp NULL DEFAULT NULL,
  `deleted_at` timestamp NULL DEFAULT NULL
) ENGINE=InnoDB DEFAULT CHARSET=utf8mb4 COLLATE=utf8mb4_unicode_ci;

-- --------------------------------------------------------

--
-- Table structure for table `reset_password`
--

CREATE TABLE `reset_password` (
  `id` bigint(20) UNSIGNED NOT NULL,
  `module` varchar(100) COLLATE utf8mb4_unicode_ci NOT NULL,
  `email` varchar(100) COLLATE utf8mb4_unicode_ci NOT NULL,
  `token` varchar(255) COLLATE utf8mb4_unicode_ci NOT NULL,
  `created_at` timestamp NULL DEFAULT NULL,
  `updated_at` timestamp NULL DEFAULT NULL,
  `deleted_at` timestamp NULL DEFAULT NULL
) ENGINE=InnoDB DEFAULT CHARSET=utf8mb4 COLLATE=utf8mb4_unicode_ci;

--
-- Dumping data for table `reset_password`
--

INSERT INTO `reset_password` (`id`, `module`, `email`, `token`, `created_at`, `updated_at`, `deleted_at`) VALUES
(1, 'users', 'Zxc@yopmail.com', 'AwGQCYppCp5A4hxNQcc3BxQQNbg7cFq7EUDxNgx5TCsPMAgBCU3Jz6y6vW6qlXSRHCDUQS0N12CkJeuinDaDXEiKqGDcT2zLcrq2Mj6xuL4JlL3l31TkwLGIQS0lxs2FeYZ5pphNgcPAazPWxPlPsH', '2022-07-29 11:34:44', NULL, NULL);

-- --------------------------------------------------------

--
-- Table structure for table `scenes`
--

CREATE TABLE `scenes` (
  `id` bigint(20) UNSIGNED NOT NULL,
  `shot_list_id` bigint(20) UNSIGNED NOT NULL,
  `size` varchar(150) COLLATE utf8mb4_unicode_ci DEFAULT NULL,
  `title` varchar(150) COLLATE utf8mb4_unicode_ci DEFAULT NULL,
  `slug` varchar(150) COLLATE utf8mb4_unicode_ci NOT NULL,
  `image_url` text COLLATE utf8mb4_unicode_ci,
  `description` text COLLATE utf8mb4_unicode_ci,
  `angle` varchar(150) COLLATE utf8mb4_unicode_ci DEFAULT NULL,
  `lens` varchar(150) COLLATE utf8mb4_unicode_ci DEFAULT NULL,
  `internal_external` varchar(150) COLLATE utf8mb4_unicode_ci DEFAULT NULL,
  `sun_time` varchar(150) COLLATE utf8mb4_unicode_ci DEFAULT NULL,
  `location` text COLLATE utf8mb4_unicode_ci,
  `location_pin` text COLLATE utf8mb4_unicode_ci,
  `cast` varchar(150) COLLATE utf8mb4_unicode_ci DEFAULT NULL,
  `wardrobe` varchar(150) COLLATE utf8mb4_unicode_ci DEFAULT NULL,
  `props` varchar(150) COLLATE utf8mb4_unicode_ci DEFAULT NULL,
  `action` varchar(150) COLLATE utf8mb4_unicode_ci DEFAULT NULL,
  `speed` varchar(150) COLLATE utf8mb4_unicode_ci DEFAULT NULL,
  `sound` varchar(150) COLLATE utf8mb4_unicode_ci DEFAULT NULL,
  `timepicker` varchar(150) COLLATE utf8mb4_unicode_ci DEFAULT NULL,
  `grip` varchar(150) COLLATE utf8mb4_unicode_ci DEFAULT NULL,
  `lines_dialogue_english` varchar(150) COLLATE utf8mb4_unicode_ci DEFAULT NULL,
  `lines_dialogue_foreign` varchar(150) COLLATE utf8mb4_unicode_ci DEFAULT NULL,
  `camera` varchar(150) COLLATE utf8mb4_unicode_ci DEFAULT NULL,
  `is_complete` enum('1','0') COLLATE utf8mb4_unicode_ci NOT NULL DEFAULT '0',
  `sort_order` int(11) DEFAULT NULL,
  `shoot_sort_order` int(11) DEFAULT NULL,
  `scene_no` int(11) NOT NULL,
  `status` enum('1','0') COLLATE utf8mb4_unicode_ci NOT NULL DEFAULT '1',
  `created_at` timestamp NULL DEFAULT NULL,
  `updated_at` timestamp NULL DEFAULT NULL,
  `deleted_at` timestamp NULL DEFAULT NULL
) ENGINE=InnoDB DEFAULT CHARSET=utf8mb4 COLLATE=utf8mb4_unicode_ci;

--
-- Dumping data for table `scenes`
--

INSERT INTO `scenes` (`id`, `shot_list_id`, `size`, `title`, `slug`, `image_url`, `description`, `angle`, `lens`, `internal_external`, `sun_time`, `location`, `location_pin`, `cast`, `wardrobe`, `props`, `action`, `speed`, `sound`, `timepicker`, `grip`, `lines_dialogue_english`, `lines_dialogue_foreign`, `camera`, `is_complete`, `sort_order`, `shoot_sort_order`, `scene_no`, `status`, `created_at`, `updated_at`, `deleted_at`) VALUES
(1, 1, NULL, 'Add Title', '164120509161d2cd638a4e1', NULL, 'Add Description', NULL, NULL, NULL, NULL, NULL, NULL, NULL, NULL, NULL, NULL, NULL, NULL, NULL, NULL, NULL, NULL, NULL, '1', 1, NULL, 0, '1', '2022-01-03 10:18:11', '2022-01-03 10:18:38', NULL),
(2, 1, NULL, 'Add Title', '164120509361d2cd65ec27b', NULL, 'Add Description', NULL, NULL, NULL, NULL, NULL, NULL, NULL, NULL, NULL, NULL, NULL, NULL, NULL, NULL, NULL, NULL, NULL, '1', 2, NULL, 0, '1', '2022-01-03 10:18:13', '2022-01-03 10:18:47', NULL),
(3, 1, NULL, 'Add Title', '164120509661d2cd6811f3c', NULL, 'Add Description', NULL, NULL, NULL, NULL, NULL, NULL, NULL, NULL, NULL, NULL, NULL, NULL, NULL, NULL, NULL, NULL, NULL, '0', 3, NULL, 0, '1', '2022-01-03 10:18:16', '2022-01-03 10:18:16', NULL),
(4, 1, NULL, 'Add Title', '164120509761d2cd69d0d6f', NULL, 'Add Description', NULL, NULL, NULL, NULL, NULL, NULL, NULL, NULL, NULL, NULL, NULL, NULL, NULL, NULL, NULL, NULL, NULL, '1', 4, NULL, 0, '1', '2022-01-03 10:18:17', '2022-01-03 10:18:51', NULL),
(5, 1, NULL, 'Add Title', '164120509961d2cd6b60ff1', NULL, 'Add Description', NULL, NULL, NULL, NULL, NULL, NULL, NULL, NULL, NULL, NULL, NULL, NULL, NULL, NULL, NULL, NULL, NULL, '0', 5, NULL, 0, '1', '2022-01-03 10:18:19', '2022-01-03 10:18:19', NULL),
(6, 2, NULL, 'Add Title', '164120515261d2cda043e08', NULL, 'Add Description', NULL, NULL, NULL, NULL, NULL, NULL, NULL, NULL, NULL, NULL, NULL, NULL, NULL, NULL, NULL, NULL, NULL, '1', 1, NULL, 0, '1', '2022-01-03 10:19:12', '2022-01-03 10:19:32', NULL),
(7, 2, NULL, 'Add Title', '164120515661d2cda48268d', NULL, 'Add Description', NULL, NULL, NULL, NULL, NULL, NULL, NULL, NULL, NULL, NULL, NULL, NULL, NULL, NULL, NULL, NULL, NULL, '0', 2, NULL, 0, '1', '2022-01-03 10:19:16', '2022-01-03 10:19:16', NULL),
(8, 2, NULL, 'Add Title', '164120515861d2cda6b9937', NULL, 'Add Description', NULL, NULL, NULL, NULL, NULL, NULL, NULL, NULL, NULL, NULL, NULL, NULL, NULL, NULL, NULL, NULL, NULL, '0', 3, NULL, 0, '1', '2022-01-03 10:19:18', '2022-01-03 10:19:18', NULL),
